apple_name,context,juice_style,cold_hardiness_(usda),summer_average_maximum_temperatures,country_of_origin,gardening_skill,self-fertility,pollination_group,uses,picking_season,cropping,keeping_(of_fruit),pollinating_others,ploidy,vigour,precocity,bearing_regularity,fruit_bearing,general_resistance,fireblight,scab,period_of_origin,fruit_color,fruit_size,canker,mildew,cooking_result,juice_color,fruit_persistence,cedar_apple_rust,bitter_pit,awards,organic_culture,chill_requirement,treetype
Porter's Perfection cider apple tree,"Porter's Perfection is a 19th century English cider variety producing a bittersharp juice. The juice quality is very good, but it is best used as a blend with other varieties.
Fill in the form below and we will notify you when Porter's Perfection cider apple tree is back in stock.
Porter's Perfection can lapse into bienneial bearing with age. This can be addressed by heavily thinning the fruitlets in late spring in the ""on"" year. However in other respects this is an easy tree to grow, and one of the more disease-resistant of English cider varieties.
Advice on fruit tree pollination.
Somerset, England - 19th century.",Bittersharp (cider),(5) -20F / -29C,Cool ( 20-24C / 68-75F),United Kingdom,Average,Not self-fertile,3.0,Hard cider,Late,Heavy,2-3 weeks,Average,Diploid,Vigorous,,Biennial tendency,Spur-bearer,Good,,Some resistance,1800 - 1849,Orange flush,Average,Some resistance,,,,Normal ripening,,,,,,Apple Cider tree
Reine des Pommes cider apple tree,"Reine des Pommes is a well-regarded traditional French cider variety, producing a high-quality bittersweet juice.
It is usually a regular cropper, and easy to grow.  It flowers in the middle of the apple blossom season, and in its native area the apples are harvested in November.
If you are looking to add the fresh apple flavors of classic French ciders to your cider blend Reine des Pommes is an excellent choice.
Fill in the form below and we will notify you when Reine des Pommes cider apple tree is back in stock.
Reine des Pommes produces a tree of average vigor.  It grows with a spreading habit and the branches tend to droop downwards.
Advice on fruit tree pollination.
Reine des Pommes seems to have originated from the Ille et Vilaine department of Brittany in north west France, one of the main cider-growing areas.",Bittersweet (cider),,"Cool ( 20-24C / 68-75F), Warm (25-30C / 76-85F)",France,,,,Hard cider,Mid,Good,2-3 weeks,,,Average vigour,,,,,,,1800 - 1849,,,,,,,,,,,,,Apple Cider tree
Somerset Redstreak cider apple tree,"A traditional English cider apple producing a bittersweet juice. Somerset Redstreak is one of the main commercial cider varieties planted in England.
Fill in the form below and we will notify you when Somerset Redstreak cider apple tree is back in stock.
Somerset Redstreak is slightly prone to biennial bearing, fruiting more heavily in alternate years. This can be controlled by heavier thinning in the ""on"" year.
It also ripens in October in England, quite a bit earlier than the main late-season cider varieties which tend to ripen in November.
Advice on fruit tree pollination.
England, early 20th century.",Bittersweet (cider),(5) -20F / -29C,Cool ( 20-24C / 68-75F),United Kingdom,Average,Not self-fertile,5.0,Hard cider,Late,Good,2-3 weeks,Average,Diploid,Slightly large,Precocious,Biennial tendency,Spur-bearer,Average,,Some resistance,1900 - 1949,"Orange / Red, Red striped",,,,,,Normal ripening,,,,,,Apple Cider tree
Stembridge Cluster cider apple tree,"A traditional English hard cider apple from the town of Stembridge in Somerset.
Stembridge Cluster produces a full bittersweet juice.
Fill in the form below and we will notify you when Stembridge Cluster cider apple tree is back in stock.
Like many English cider varieties, Stembridge Cluster has a strong tendency towards biennial bearing.  Counter this by making sure it is not allowed over-crop.
Advice on fruit tree pollination.",Bittersweet (cider),(4) -30F / -34C,Cool ( 20-24C / 68-75F),United Kingdom,Average,Not self-fertile,2.0,Hard cider,Late,Good,2-3 weeks,Average,Diploid,Average vigour,Precocious,Biennial tendency,Spur-bearer,Average,,,1900 - 1949,Green / Red,Average,,,,,,,,,,,Apple Cider tree
Stoke Red cider apple tree,"Stoke Red is a well-regarded high quality English cider apple varieties. It adds a classic bittersharp component to cider blends, and can also be used to make a single-varietal cider.
Fill in the form below and we will notify you when Stoke Red cider apple tree is back in stock.
Stoke Red has generally good disease resistance and is fairly easy to grow. The main issue is that it blooms very late. This is useful in northern areas where late frosts can be a problem, but make sure you have a suitable pollinator variety.
Stoke Red can also lapse into biennial bearing, in other words bearing a crop only every other year. This can be avoided by ensuring that the fruitlets are thinned in early June to prevent over-cropping, which is often the trigger for a poor crop the following year.
Advice on fruit tree pollination.
Stoke Red originates from Rodney Stoke, a village in Somerset, England, before 1920.",Bittersharp (cider),(5) -20F / -29C,Cool ( 20-24C / 68-75F),United Kingdom,Average,Not self-fertile,6.0,Hard cider,Very late,Heavy,2-3 weeks,Average,Diploid,Average vigour,Slow to start bearing,Biennial tendency,Spur-bearer,Average,Some susceptibility,Very resistant,1900 - 1949,Orange / Red,,,,,,Normal ripening,,,,,,Apple Cider tree
Sweet Coppin cider apple tree,"Sweet Coppin is a good quality traditional English cider variety, producing a sweet juice which is low in tannin and acid.  It is therefore a good variety for providing sweetness to tannic or sharp blends.
Fill in the form below and we will notify you when Sweet Coppin cider apple tree is back in stock.
Sweet Coppin is a weak-growing, heavy-cropping variety - a combination that invariably leads to biennial bearing in cider apples. Counter this by thinning the fruitlets to prevent it setting an over-heavy crop.
Advice on fruit tree pollination.
Sweet Coppin originates from the south-western English county of Devon.",Sweet (cider),(5) -20F / -29C,Cool ( 20-24C / 68-75F),United Kingdom,Average,Not self-fertile,3.0,Hard cider,Very late,Light,1-3 days,Average,Diploid,Slightly small,,Biennial tendency,,Average,,,1850 - 1899,Green / Red,Large,,Some susceptibility,,,Fruit drops when ripe,,,,,,Apple Cider tree
Vilberie cider apple tree,"Vilberie is a traditional French hard-cider variety, producing a very tannic but sweet bittersweet juice.
The juice would normally be blended with juice from other varieties to produce a balanced cider.
Fill in the form below and we will notify you when Vilberie cider apple tree is back in stock.
Like a number of traditional English and French cider varieties, Vilberie is very late-blooming - in southern England or northern France it will typically flower in the last week of May. This can make cross-pollination an issue unless you have other late-flowering varieties available, although it seems to have reasonable self-fertility.
Advice on fruit tree pollination.
Vilberie is an old French variety, introduced to England in the late 19th century.",Bittersweet (cider),(5) -20F / -29C,"Cool ( 20-24C / 68-75F), Warm (25-30C / 76-85F)",France,Experienced,Partially self-fertile,6.0,Hard cider,Very late,Heavy,2-3 weeks,Average,Diploid,Slightly large,Precocious,,,Average,Some susceptibility,,1800 - 1849,Green,Average,,,,,Normal ripening,,,,,,Apple Cider tree
Yarlington Mill cider apple tree,"Yarlington Mill is a heavy-cropping traditional English cider apple variety, and quite widely grown in the English cider-producing regions. It produces a bittersweet juice.
Fill in the form below and we will notify you when Yarlington Mill cider apple tree is back in stock.
Yarlington Mill can become a biennial bearer, but this can be controlled by thinning the crop in the ""on"" year.
Advice on fruit tree pollination.
Yarlington Mill is named after the town of Yarlington, Somerset, England. It was discovered in the early 20th century.",Bittersweet (cider),(5) -20F / -29C,"Cool ( 20-24C / 68-75F), Warm (25-30C / 76-85F)",United Kingdom,Average,Not self-fertile,5.0,Hard cider,Very late,Heavy,2-3 weeks,Average,Diploid,Average vigour,Slow to start bearing,Biennial tendency,Spur-bearer,Average,Some susceptibility,Some susceptibility,1900 - 1949,Orange / Red,Average,Very resistant,,,,Fruit drops when ripe,,,,,,Apple Cider tree
