ID,name,vapage,website,phone,address,region,descr,reglatlong,times,fees,amenities,trails,shipsto
194,Sharp Rock Vineyards,https://www.virginiawine.org/wineries/sharp-rock-vineyards,http://www.sharprockvineyards.com,540-987-8020,"5 Sharp Rock Rd, Sperryville, Virginia 22740",Northern Virginia,"A 225 year old family farm located on the beautiful Hughes River in an unspoiled valley at the foot of Old Rag Mountain.We craft twelve award-winning wines produced in limited quantities from handpicked grapes grown in our own vineyards,and sold only in our renovated 100 year old barn tasting room.","(38.5535354, -78.2391036)","['Mon: Closed', 'Tues: Closed', 'Wed: Closed', 'Thurs: Closed', 'Fri: 11:00 AM - 5:00 PM', 'Sat: 11:00 AM - 5:00 PM', 'Sun: 11:00 AM - 5:00 PM', 'Child: Friendly', 'Food: Available: Light Fare', 'Group: Tours', 'Overnight: Stay', 'Pet: Friendly', 'Picnic: Area', 'Private: Parties', 'Tasting: Room', 'Weddings:  ', 'Wine: Shop', 'Artisanal: Wineries of Rappahannock County', 'Blue: Ridge ', 'Foothills: Scenic Wine Trail', 'Jefferson: Heritage Trail', 'Tween: Rivers Trail']",Tour Fee: n/c,"['Features', 'Child Friendly', 'Food Available', 'Light Fare', 'Group Tours', 'Overnight Stay', 'Pet Friendly', 'Picnic Area', 'Private Parties', 'Tasting Room', 'Weddings', 'Wine Shop']","[('Artisanal Wineries of Rappahannock County', 'http://www.artwinerc.com/'), ('Blue Ridge “Whiskey Wine Loop”', 'https://www.discovershenandoah.com'), ('Foothills Scenic Wine Trail', 'https://www.FootHillsScenicWineTrail.com'), ('Jefferson Heritage Trail', 'https://jeffersonheritagetrail.com'), ('Tween Rivers Trail', 'http://www.tweenriverstrail.com/')]",
195,Shenandoah Vineyards,https://www.virginiawine.org/wineries/shenandoah-vineyards,http://www.ShenandoahVineyardsVA.com,(540) 984-8699,"3659 S. Ox Rd., Edinburg, VA 22824",Shenandoah Valley,"Shenandoah Vineyards is the 2nd oldest active winery in Virginia, founded in 1976. Housed in a red barn dating to the Civil War, the winery sits atop an old stone foundation which serves as the aging cellar. An upper story deck adjoining the barn offers a sweeping view of the mountains. In 2018, Michael Shaps purchased the winery and replanted some of the vineyards with grapes suitable for the Shenandoah Valley. Michael Shaps makes award-winning wines in an old-world style that showcase the terroir and varietals.","(38.8466884, -78.5577001)","['Mon: 11:00 AM - 5:00 PM', 'Tues: 11:00 AM - 5:00 PM', 'Wed: 11:00 AM - 5:00 PM', 'Thurs: 11:00 AM - 5:00 PM', 'Fri: 11:00 AM - 5:00 PM', 'Sat: 11:00 AM - 5:00 PM', 'Sun: 11:00 AM - 5:00 PM', 'Bu: s', 'Child: Friendly', 'Food: Available: Light Fare', 'Pet: Friendly', 'Picnic: Area', 'Private: Parties', 'Tasting: Room', 'Wine: Shop', 'Shenandoah: County Wine Trail', 'Shenandoah: Valley Wine Trail']",Tasting Fee: $10.00,"['Features', 'Bus/RV Parking', 'Child Friendly', 'Food Available', 'Light Fare', 'Pet Friendly', 'Picnic Area', 'Private Parties', 'Tasting Room', 'Wine Shop']","[('Shenandoah County Wine Trail', 'https://www.ShenandoahTravel.org'), ('Shenandoah Valley Wine Trail', 'https://www.shenandoahvalleywinetrail.com')]",['Virginia']
196,Skippers Creek Vineyard,https://www.virginiawine.org/wineries/skippers-creek-vineyard,http://skipperscreek.com/,804.598.7291,"965 Rocky Ford Rd, Powhatan, VA 23139",Central Virginia,"Skippers Creek Vineyard is located on property owned by Debbie’s family for over 75 years. Growing up, dairy and tobacco farming filled her day with many hours of hard work. Today, sitting about 300 feet above sea level, the pastures thrive with five acres of viniferous vines.","(37.4696489, -77.8687636)","['Mon: Closed - Closed', 'Tues: Closed - Closed', 'Wed: Closed - Closed', 'Thurs: Closed - Closed', 'Fri: Closed - Closed', 'Sat: 2:00 PM -  6:00 PM', 'Sun: 2:00 PM -  6:00 PM']",Tasting Fee: free,,,
197,Slater Run Vineyards,https://www.virginiawine.org/wineries/slater-run-vineyards,http://www.slaterrun.com,540.818.1476,"1500 Crenshaw Road, Upperville, VA 20184",Northern Virginia,"One vineyard, two venues.","(38.9741294, -77.8265367)","['Mon: 11:00 AM - 5:00 PM', 'Tues: Closed', 'Wed: Closed', 'Thurs: 11:00 AM - 5:00 PM', 'Fri: 11:00 AM - 5:00 PM', 'Sat: 11:00 AM - 5:00 PM', 'Sun: 11:00 AM - 5:00 PM', 'Food: Available: Light Fare', 'Group: Tours', 'Picnic: Area', 'Private: Parties', 'Reservation: Required', 'Tasting: Room', 'Weddings:  ', 'Wine: Shop', 'Fauquier: County Wine Trail']",Reserve Tasting Fee: $50.00 per person for a tasting/tour with complimentary glass of wine and tour.,"['Features', 'Food Available', 'Light Fare', 'Group Tours', 'Picnic Area', 'Private Parties', 'Reservation Required', 'Tasting Room', 'Weddings', 'Wine Shop']","[('Fauquier County Wine Trail', 'https://www.fauquiertourism.com/wineries.html\n')]",
198,Spinning Jenny Vineyard,https://www.virginiawine.org/wineries/spinning-jenny-vineyard,https://spinningjennyvineyard.com,5409229829,"2664 Old Route 100 Road, Draper, Draper, VA 24324",Blue Ridge,"Located directly between the New River Trail and the Transamerica Cycling Route 76, Spinning Jenny Vineyard is a small estate winery committed to producing quality wines from grape varieties that thrive in the southwest Virginia climate.","(37.0048869, -80.743363)","['Mon: Closed', 'Tues: Closed', 'Wed: Closed', 'Thurs: 12:00 PM - 6:00 PM', 'Fri: 12:00 PM - 6:00 PM', 'Sat: 12:00 PM - 3:00 PM', 'Sun: 12:00 PM - 6:00 PM', 'Food: Available: Light Fare', 'Group: Tours', 'Picnic: Area', 'Private: Parties', 'Tasting: Room', 'Wine: Shop', 'Blue: Ridge Wine Trail']",Reserve Tasting Fee: $12.00 for 9 wines,"['Features', 'Food Available', 'Light Fare', 'Group Tours', 'Picnic Area', 'Private Parties', 'Tasting Room', 'Wine Shop']","[('Blue Ridge Wine Trail', 'https://www.blueridgewinetrail.com\n')]",
199,Spring Run Vineyards,https://www.virginiawine.org/wineries/spring-run-vineyards,http://www.springrunvineyards.com,(804)382-4529,"10700 Spring Run Road, Chesterfield, VA 23832",Central Virginia,"Spring Run Vineyards is a family-owned and operated boutique “nano-” Virginia Farm Winery. We pride ourselves on hand-crafting quality wines by concentrating on hybrid varieties that excel in Virginia’s extreme climate and withstand minimal spraying requirements. We have been growing wine grapes since 2005 and will grow to 3 acres. We also grow blackberries and produce small lots of fine Blackberry wines. Be sure to check out the latest information on our Facebook page at ""Spring Run Vineyards""","(37.363343, -77.596991)","['Mon: Closed - Closed', 'Tues: Closed - Closed', 'Wed: Closed - Closed', 'Thurs: Closed - Closed', 'Fri: Closed - Closed', 'Sat: 1:00 PM - 5:00 PM', 'Sun: Closed - Closed', 'Child: Friendly', 'Pet: Friendly', 'Picnic: Area', 'Private: Parties', 'Tasting: Room']",Tasting Fee: $5.00 if bring a canned good $1. off,"['Features', 'Child Friendly', 'Pet Friendly', 'Picnic Area', 'Private Parties', 'Tasting Room']",,
200,Stanburn Winery,https://www.virginiawine.org/wineries/stanburn-winery,http://www.stanburnwinery.com,276-694-7074,"158 Conner Dr., Stuart, VA 24171",Blue Ridge,"Just like our vineyard, Stanburn Winery is a family adventure. Since 1999, our family has owned and operated a 15-acre vineyard in rural, scenic Patrick County, Va. We now take our passion for growing grapes to bring you our wines bursting with flavor. We nurture six grape varieties including, Chardonnay, Traminette, Cabernet Franc, Vidal Blanc, Chambourcin, and Barbera. We offer 12 wines with eight being dry, two semi-sweet, and two sweet. Thanks for giving Stanburn Winery a try, and we hope you like it as much as we have enjoyed making it for you.","(36.5870609, -80.2003044)","['Mon: Closed - Closed', 'Tues: Closed - Closed', 'Wed: Closed - Closed', 'Thurs: Closed - Closed', 'Fri: Closed - Closed', 'Sat: 1:00 PM -  6:00 PM', 'Sun: 2:00 PM -  6:00 PM', 'Group: Tours', 'Picnic: Area', 'Private: Parties', 'Tasting: Room', 'Weddings:  ', 'Wine: Shop', 'Mountain: Road Wine Experience ']",Tasting Fee: $5.00,"['Features', 'Group Tours', 'Picnic Area', 'Private Parties', 'Tasting Room', 'Weddings', 'Wine Shop']","[('Mountain Road Wine Experience', 'http://www.mountainroadwineexperience.com/')]",['Virginia']
201,Star in the Valley Estate Winery,https://www.virginiawine.org/wineries/star-in-the-valley-estate-winery,www.starinthevalley.com,540-514-1687,"33 Amos Lane, Strasburg, VA 22657",Shenandoah Valley,"Since the beginning, we've always had an ear to the ground and an eye to the sky. At over 1000 feet, our vineyards are planted on the oldest mountains in the world. Star in the Valley is committed to producing small batch wines reflective of the terroir of the Shenandoah Valley.","(39.0317722, -78.4119916)","['Mon: Closed - Closed', 'Tues: Closed - Closed', 'Wed: Closed - Closed', 'Thurs: Closed - Closed', 'Fri: 1:00 PM -  6:00 PM', 'Sat: 11:00 AM -  6:00 PM', 'Sun: Closed - Closed', 'Child: Friendly', 'Picnic: Area', 'Tasting: Room', 'Shenandoah: County Wine Trail', 'Shenandoah: Valley Wine Trail']",Reserve Tasting Fee: 9.00,"['Features', 'Child Friendly', 'Picnic Area', 'Tasting Room']","[('Shenandoah County Wine Trail', 'https://www.ShenandoahTravel.org'), ('Shenandoah Valley Wine Trail', 'https://www.shenandoahvalleywinetrail.com')]",
202,Stinson Vineyards,https://www.virginiawine.org/wineries/stinson-vineyards,http://www.stinsonvineyards.com,434.823.7300,"4744 Sugar Hollow Road , Crozet, VA 22932",Central Virginia,"Stinson Vineyards is a family run boutique vineyard located just West of Charlottesville in the scenic foothills of Virginia's Blue Ridge Mountains.  Nestled in ""downtown"" White Hall, the winding driveway boasts some of the area's best views.  A repurposed garage winery combines modern architecture and equipment with traditional winemaking techniques.","(38.1195948, -78.6645613)","['Mon: Closed', 'Tues: Closed', 'Wed: Closed', 'Thurs: 11:00 AM - 5:00 PM', 'Fri: 11:00 AM - 5:00 PM', 'Sat: 11:00 AM - 5:00 PM', 'Sun: 11:00 AM - 5:00 PM', 'Child: Friendly', 'Food: Available: Light Fare', 'Overnight: Stay', 'Pet: Friendly', 'Picnic: Area', 'Tasting: Room', 'Monticello: Wine Trail', 'Skyline: Wine Trail']","Tasting Fee: $10.00/person, $12.00/person for groups of 7 or more. Groups of 7 + require a reservation.","['Features', 'Child Friendly', 'Food Available', 'Light Fare', 'Overnight Stay', 'Pet Friendly', 'Picnic Area', 'Tasting Room']","[('Monticello Wine Trail', 'https://www.monticellowinetrail.com\n'), ('Skyline Wine Trail', 'https://www.skylinewinetrail.com/')]","['Arizona', 'Arkansas', 'California', 'Colorado', 'District of Columbia', 'Florida', 'Georgia', 'Hawaii', 'Idaho', 'Illinois', 'Indiana', 'Iowa', 'Kansas', 'Louisiana', 'Maine', 'Maryland', 'Massachusetts', 'Minnesota', 'Missouri', 'Nebraska', 'Nevada', 'New Hampshire', 'New Mexico', 'New York', 'North Carolina', 'North Dakota', 'Ohio', 'Oklahoma', 'Oregon', 'Pennsylvania', 'South Carolina', 'Tennessee', 'Texas', 'Vermont', 'Virginia', 'Washington', 'West Virginia', 'Wisconsin', 'Wyoming']"
203,Stone House Meadery,https://www.virginiawine.org/wineries/stone-house-meadery,http://www.stonehousemeadery.com,5715120763,"36580 Shoemaker School Road, PURCELLVILLE, VA 20132",Northern Virginia,"Stonehouse Meadery is a small family owned and operated winery, that use local  honey to ferment into wine. We focus on making high quality mead using local honey and 21st century knowledge. Our goal is to produce good mead on a small scale with the highest quality. The meadery will offer 3-5 different wines to the public begining early spring, 2013.","(39.088721, -77.740026)",Appoint ONLY.,,"['Features', 'Tasting Room']",,
204,Stone Mountain Vineyards,https://www.virginiawine.org/wineries/stone-mountain-vineyards,http://www.stonemountainvineyards.com,434-990-9463,"1376 Wyatt Mountain Road, Dyke, VA 22935",Central Virginia,"Located at 1,700 feet, Stone Mountain Vineyards provides a unique perspective from their expansive observation deck. The large tasting room features rich hardwood flooring, comfortable gathering areas and a heartwood Pine Tasting Bar. While looking over the observation deck to the valley below and with a glass of Stone Mountain Cabernet Franc in hand, the true vision of Stone Mountain Founder Al Breiner and Founding Winemaker Chris Breiner can be seen, tasted, and fully appreciated.","(38.2799077, -78.5874764)","['Mon: 12:00 PM -  6:00 PM', 'Tues: Closed - Closed', 'Wed: Closed - Closed', 'Thurs: 12:00 PM -  6:00 PM', 'Fri: 12:00 PM -  7:00 PM', 'Sat: 12:00 PM -  7:00 PM', 'Sun: 12:00 PM -  7:00 PM', 'Monticello: Wine Trail']",Tour Fee: $20.00,,"[('Monticello Wine Trail', 'https://www.monticellowinetrail.com\n')]","['Maryland', 'Minnesota', 'Virginia']"
205,Stone Tower Winery,https://www.virginiawine.org/wineries/stone-tower-winery,http://www.stonetowerwinery.com/,(703) 777-2797,"19925 Hogback Mountain Rd, Leesburg, VA 20175",Northern Virginia,"Stone Tower Winery is a family-owned and -operated winery, where our premium wines and magnificent views are equally matched by impeccable hospitality. Working with a team of top-notch viticulturists, soil specialists and oenologists, we've created over 50 acres of stunning vineyards of classic French varietals on our 206 acre property atop Hogback Mountain in Leesburg, Virginia. Our commitment to authentic quality and stewardship of the land is reflected in every aspect of our process. From bud to grape to bottle, this attention to detail allows us to create spectacular wines.","(39.063064, -77.635397)","Friday through Monday, from 11AM to 6PM; with our last tastings at 5:30pm. Tuesday & Wednesday by appointment. 

Reservations are required for all groups over six.",Tour Fee: 35.00,"['Features', 'Food Available', 'Light Fare', 'Group Tours', 'Picnic Area', 'Private Parties', 'Tasting Room', 'Weddings', 'Wine Shop']","[('Loudoun Wine Trail', 'https://www.visitloudoun.org\n'), (""Tuskie's Wine Trail"", 'http://www.tuskies.com/WineTrail/')]","['Florida', 'Minnesota', 'Virginia']"
206,Sunset Hills Vineyard,https://www.virginiawine.org/wineries/sunset-hills-vineyard,www.sunsethillsvineyard.com,540-882-4560,"38295 Fremont Overlook Lane, Purcellville, Virginia 20132",Northern Virginia,"Sunset Hills Vineyard is all about exceptional wine, conservation and sustainability. We grow our grapes on our five farms to make award winning Virginia wine from the nearly 80,000 vines we tend by hand.  We are dedicated to being gentle on the land and by using Virginia sunshine twice: first to ripen over 80 acres of Virginia grapes and again with 180 solar panels to produce enough electricity to power the winery and winemaking operations.","(39.179788, -77.677919)","['Mon: 1:00 PM -  6:00 PM', 'Tues: 1:00 PM -  6:00 PM', 'Wed: 1:00 PM -  6:00 PM', 'Thurs: 1:00 PM -  6:00 PM', 'Fri: 1:00 PM -  7:00 PM', 'Sat: 12:00 PM -  7:00 PM', 'Sun: 12:00 PM -  7:00 PM', 'Food: Available: Light Fare', 'Group: Tours', 'Picnic: Area', 'Private: Parties', 'Tasting: Room', 'Weddings:  ', 'Loudoun: Wine Trail', 'Tuski: e']",Tasting Fee: $10.00,"['Features', 'Food Available', 'Light Fare', 'Group Tours', 'Picnic Area', 'Private Parties', 'Tasting Room', 'Weddings']","[('Loudoun Wine Trail', 'https://www.visitloudoun.org\n'), (""Tuskie's Wine Trail"", 'http://www.tuskies.com/WineTrail/')]","['Alaska', 'California', 'Florida', 'Maryland', 'Minnesota', 'Virginia']"
207,Tarara Winery,https://www.virginiawine.org/wineries/tarara-winery,http://www.tarara.com,703-771-7100,"13648 Tarara Lane, Leesburg, Virginia 20176",Northern Virginia,"Wines with site in mind.  We aim to craft wine that is the best representation of a place and time to showcase our unique sites and vintages.  Our vineyards are planted to Chardonnay, Viognier, Petit Manseng, Merlot, Syrah, Cabernet Sauvignon, Cabernet Franc, Tannat and Petit Verdot.  Bottlings include Nevaeh Vineyard Red and White, Tranquility Vineyard Red, Chardonnay, Cabernet Franc and a white and red blend called Charval and Long Bomb.","(39.2337129, -77.48196)","['Mon: 11:00 AM -  5:00 PM', 'Tues: 11:00 AM -  5:00 PM', 'Wed: 11:00 AM -  5:00 PM', 'Thurs: 11:00 AM -  5:00 PM', 'Fri: 11:00 AM -  6:00 PM', 'Sat: 11:00 AM -  6:00 PM', 'Sun: 11:00 AM -  6:00 PM', 'Food: Available: Light Fare', 'Group: Tours', 'Picnic: Area', 'Private: Parties', 'Tasting: Room', 'Wine: Shop', 'Loudoun: Wine Trail', 'Tuski: e']",Tasting Fee: 15.00-20.00 per person,"['Features', 'Food Available', 'Light Fare', 'Group Tours', 'Picnic Area', 'Private Parties', 'Tasting Room', 'Wine Shop']","[('Loudoun Wine Trail', 'https://www.visitloudoun.org\n'), (""Tuskie's Wine Trail"", 'http://www.tuskies.com/WineTrail/')]","['Alaska', 'Florida', 'Louisiana', 'Maryland', 'Minnesota', 'Missouri', 'Nevada', 'Pennsylvania', 'Vermont', 'Virginia']"
208,Tasting Room & Taphouse at Mount Ida Reserve,https://www.virginiawine.org/wineries/tasting-room-taphouse-at-mount-ida-reserve,https://mountidareserve.com/,434-286-4282,"5931 Blenheim Road, Charlottesville, VA 22902",Central Virginia,"Our Tasting Room & Taphouse brings a new dimension to Mount Ida Reserve’s time-honored tradition of hospitality. A warm, relaxed, yet refined atmosphere, created with the genuine care and comfort of our guests in mind.","(37.8752587, -78.4962447)","['Mon: 12:00 PM - 6:00 PM', 'Tues: 12:00 PM - 6:00 PM', 'Wed: 12:00 PM - 6:00 PM', 'Thurs: 12:00 PM - 6:00 PM', 'Fri: 12:00 PM - 7:00 PM', 'Sat: 12:00 PM - 7:00 PM', 'Sun: 12:00 PM - 6:00 PM', 'Bu: s', 'Child: Friendly', 'Food: Available: Light Fare', 'Food: Available: Restaurant', 'Overnight: Stay', 'Pet: Friendly', 'Private: Parties', 'Tasting: Room', 'Weddings:  ']",Tasting Fee: $12.00,"['Features', 'Bus/RV Parking', 'Child Friendly', 'Food Available', 'Light Fare', 'Food Available', 'Restaurant', 'Overnight Stay', 'Pet Friendly', 'Private Parties', 'Tasting Room', 'Weddings']",,['Virginia']
209,Terra Nebulo Vineyards,https://www.virginiawine.org/wineries/terra-nebulo-vineyards,http://www.terranebulo.com,540-882-3800,"39892 Old Wheatland Rd , Waterford, VA 20197",Northern Virginia,New winery opened 2015 in Waterford VA. Amish timber frame construction with  unique inside features and use of reclaimed wood.  Set outside the 1733 Quaker Village of Waterford with gorgeous views.,"(39.192107, -77.620697)",,Reserve Tasting Fee: $14.00,"['Features', 'Food Available', 'Light Fare', 'Private Parties', 'Tasting Room', 'Weddings']","[('Loudoun Wine Trail', 'https://www.visitloudoun.org\n'), (""Tuskie's Wine Trail"", 'http://www.tuskies.com/WineTrail/')]",
210,The Barns at Hamilton Station Vineyards,https://www.virginiawine.org/wineries/the-barns-at-hamilton-station-vineyards,http://www.thebarnsathamiltonstation.com,540-338-5309,"16804 Hamilton Station Road, Hamilton, VA, VA 20158",Northern Virginia,"The Barns at Hamilton Station Vineyards, located in Hamilton, VA  showcases hand crafted wines made from Virginia grapes on a former historic dairy farm in western Loudoun County.  Our restored 105 year old barn with upper and lower levels; an expansive deck and large patio, milk house and former smoke house offer beautiful views overlooking a pond. Tasting fee is $8.00. Groups of 8 or more are required to make reservations and the tasting fee is $13.00. Our last call for wine and tastings on Thurs/Sat/Sun/Mon is at 5:30pm unless we have a special event in which case we close at 5pm. Fridays we stay open until 8pm.  Please check our website for updates.  We hope you come and visit us soon!","(39.151434, -77.644091)","['Mon: Closed - Closed', 'Tues: Closed - Closed', 'Wed: Closed - Closed', 'Thurs: Closed - Closed', 'Fri: 11:00 AM -  8:00 PM', 'Sat: 11:00 AM -  5:30 PM', 'Sun: 11:00 AM -  5:30 PM', 'Food: Available: Light Fare', 'Group: Tours', 'Picnic: Area', 'Private: Parties', 'Tasting: Room', 'Weddings:  ', 'Wine: Shop', 'Loudoun: Wine Trail', 'Tuski: e']",Reserve Tasting Fee: 13.00 for groups over 8 people,"['Features', 'Food Available', 'Light Fare', 'Group Tours', 'Picnic Area', 'Private Parties', 'Tasting Room', 'Weddings', 'Wine Shop']","[('Loudoun Wine Trail', 'https://www.visitloudoun.org\n'), (""Tuskie's Wine Trail"", 'http://www.tuskies.com/WineTrail/')]",
211,The Briede Family Vineyards,https://www.virginiawine.org/wineries/the-briede-family-vineyards-0,https://www.briedevineyards.com,540-664-2048,"450 Green Spring Road, Winchester, VA 22603",Shenandoah Valley,We are sustainable grower serving our very own local grown wines and featuring French Champagnes. We are a small boutique winery in a quiet setting located in the Shenandoah AVA. Come visit us in our newly remodeled French Country style barn and enjoy tasting sparkling wines and champagnes as we offer a variety of wines to fit everyone's palate! We also have our own still wines grown at our estate available for tasting and purchase! Our sparkling wine is aging on its lees and expected release will be 2019.,"(39.298321, -78.155087)","['Mon: Closed', 'Tues: Closed', 'Wed: Closed', 'Thurs: Closed', 'Fri: Closed', 'Sat: 1:00 PM - 6:00 PM', 'Sun: 1:00 PM - 5:00 PM', 'Child: Friendly', 'Group: Tours', 'Pet: Friendly', 'Picnic: Area', 'Private: Parties', 'Tasting: Room', 'Weddings:  ', 'Wine: Shop', 'Shenandoah: Valley Wine Trail']",,"['Features', 'Child Friendly', 'Group Tours', 'Pet Friendly', 'Picnic Area', 'Private Parties', 'Tasting Room', 'Weddings', 'Wine Shop']","[('Shenandoah Valley Wine Trail', 'https://www.shenandoahvalleywinetrail.com')]",['Virginia']
212,The Bubble Decker Wine Bar,https://www.virginiawine.org/wineries/the-bubble-decker-wine-bar,,,"8374 West Main Street, Marshall, VA 20115",Northern Virginia,,"(38.864958, -77.858241)","['Mon: Closed', 'Tues: Closed', 'Wed: Closed', 'Thurs: Closed', 'Fri: Closed', 'Sat: Closed', 'Sun: Closed', 'Food: Available: Light Fare', 'Food: Available: Restaurant', 'Private: Parties']",,"['Features', 'Food Available', 'Light Fare', 'Food Available', 'Restaurant', 'Private Parties']",,
213,The Dog and Oyster Vineyard,https://www.virginiawine.org/wineries/the-dog-and-oyster-vineyard,http://www.hopeandglory.com/thevineyard/winery.html,1-804-438-WINE (9643),"170 White Fences Drive (Vineyard), 65 Tavern Road (IHotel), Irvington, VA 22480",Chesapeake Bay,"The Dog and Oyster Vineyard is the vineyard of The Hope and Glory Inn. This boutique hotel has been  “Top 10 in America” – five times.
The quirky name was created to honor the rescue dogs that rescue the grapes from deer and other animals; and, to honor the oyster, one of the Chesapeake Bay region’s and Virginia's greatest assets.
Our wines were crafted to be paired with oysters - the only vineyard in America doing so.
All of our wines have earned many medals from America's #1 competition in San Francisco to Virginia's Governor's Cup. High marks also come from The Washington Post and the Richmond Times Dispatch wine critics.
Home to the 2015 Virginia Wine and Oyster Classic.","(37.6638469, -76.4133669)","['Mon: 12:00 PM -  6:00 PM', 'Tues: 12:00 PM -  6:00 PM', 'Wed: 12:00 PM -  6:00 PM', 'Thurs: 12:00 PM -  6:00 PM', 'Fri: 12:00 PM -  6:00 PM', 'Sat: 12:00 PM -  6:00 PM', 'Sun: 12:00 PM -  6:00 PM', 'Food: Available: Light Fare', 'Overnight: Stay', 'Picnic: Area', 'Private: Parties', 'Tasting: Room', 'Weddings:  ', 'Wine: Shop', 'Chesapeake: Bay Wine Trail']",Tour Fee: $12.00 - private tasting with owner,"['Features', 'Food Available', 'Light Fare', 'Overnight Stay', 'Picnic Area', 'Private Parties', 'Tasting Room', 'Weddings', 'Wine Shop']","[('Chesapeake Bay Wine Trail', 'https://www.chesapeakebaywinetrail.com')]",
214,The Hague Winery,https://www.virginiawine.org/wineries/the-hague-winery,http://www.thehaguewinery.com,804 472 5283,"8268 Cople Highway, PO Box 141, Hague, Virginia 22469",Chesapeake Bay,"Located on the Northern Neck at Buena Vista farm, established in 1840 by Colonel Thomas Brown. Tasting room located in historic barn overlooking vineyards, manor home and cottage.  Now open. 
Hours:  Jan-May, October-December - Friday-Sunday, 11am-5pm
              June-September - Thursday, Saturday, Sunday - 11am-5pm
                                                Friday, 11am-8:30pm,","(38.0702858, -76.6588365)","['Mon: Closed', 'Tues: Closed', 'Wed: Closed', 'Thurs: 11:00 AM - 5:00 PM', 'Fri: 11:00 AM - 5:00 PM', 'Sat: 11:00 AM - 5:00 PM', 'Sun: 11:00 AM - 5:00 PM', 'Child: Friendly', 'Food: Available: Light Fare', 'Group: Tours', 'Overnight: Stay', 'Pet: Friendly', 'Picnic: Area', 'Private: Parties', 'Tasting: Room', 'Wine: Shop']",Tasting Fee: $6.00/PERSON,"['Features', 'Child Friendly', 'Food Available', 'Light Fare', 'Group Tours', 'Overnight Stay', 'Pet Friendly', 'Picnic Area', 'Private Parties', 'Tasting Room', 'Wine Shop']",,
215,The Homeplace Vineyard,https://www.virginiawine.org/wineries/the-homeplace-vineyard,http://www.thehomeplacevineyard.com/,434-432-WINE,"568 Rigney Circle, Chatham, VA 24531",Southern Virginia,"The Homeplace Vineyard, located in Southside Virginia's Pittsylvania County, was incorporated in 2004 by Joe and Brenda Williams along with their children Renee and husband Billy, Jesse and wife Penny, and Mary and husband Chris.","(36.867752, -79.473511)","Mar - Oct Mon-Sat 11am-6pm, Nov & Dec Thurs-Sat 11am-5pm, Other times by appt.",Tasting Fee: $5.00,"['Features', 'Group Tours', 'Picnic Area', 'Private Parties', 'Tasting Room', 'Weddings', 'Wine Shop']","[('Southern Virginia Wine Trail', 'https://virginiawine.org')]",['Virginia']
