ID,name,vapage,website,phone,address,region,descr,reglatlong,times,fees,amenities,trails,shipsto
57,Cobbler Mountain Cellars,https://www.virginiawine.org/wineries/cobbler-mountain-cellars,http://www.cobblermountain.com,540-364-2802,"5909 Long Fall Lane (see notes) , via 10363 Moreland Road, Delaplane, VA 20144",Northern Virginia,"Via Hwy. 66 Exit 27 ""Marshall"". Follow our state signage 5 miles to the property. HINT: GPS the old farmhouse address~ (unposted)10363 Moreland Road, Delaplane, VA 20144. Call us for assistance. Same entrance as Long Fall Lane, OFF of Moreland. Follow private road back into the property to Tasting tavern on left. Main entrance through top porch.","(38.8474997, -77.9446183)","Thursdays, Fridays, Saturdays,Sundays and Mondays 11:00 a.m. - 5:00 p.m.

(During warmer months Sat. & Suns. until 6 p.m. May - October)

Call ahead to book group visits & private blending sessions in the Barrel Hall.  

Closed Tuesdays & Wednesdays unless by reservation.",Tour Fee: 15.00 Includes Cider & Tour,"['Features', 'Child Friendly', 'Food Available', 'Light Fare', 'Group Tours', 'Pet Friendly', 'Picnic Area', 'Private Parties', 'Tasting Room', 'Weddings', 'Wine Shop']","[('Blue Ridge Wine Way', 'https://www.blueridgewineway.com\n'), ('Fauquier County Wine Trail', 'https://www.fauquiertourism.com/wineries.html\n')]","['Alaska', 'Florida', 'Idaho', 'Louisiana', 'Minnesota', 'Missouri', 'Nebraska', 'Nevada', 'Ohio', 'Oregon', 'Virginia', 'Wyoming']"
58,Corcoran Vineyards & Cider,https://www.virginiawine.org/wineries/corcoran-vineyards-cider,http://www.corcoranvineyards.com,540-882-9073,"14635 Corkys Farm Lane, Waterford, VA 20197",Northern Virginia,Corcoran has been producing award winning wines since 2004 and now is offering our handcrafted hard cider.  Tastings of both wine and cider are done in our renovated barn. Picnics & pets are welcome.,"(39.2112292, -77.6532042)","['Mon: Closed - Closed', 'Tues: Closed - Closed', 'Wed: Closed - Closed', 'Thurs: Closed - Closed', 'Fri: Closed - Closed', 'Sat: 12:00 PM -  5:00 PM', 'Sun: 12:00 PM -  5:00 PM', 'Bu: s', 'Child: Friendly', 'Food: Available: Light Fare', 'Pet: Friendly', 'Picnic: Area', 'Private: Parties', 'Tasting: Room', 'Weddings:  ', 'Loudoun: Wine Trail', 'Tuski: e']",Tasting Fee: $12/wine $7/cider and Reservations are recommended for groups,"['Features', 'Bus/RV Parking', 'Child Friendly', 'Food Available', 'Light Fare', 'Pet Friendly', 'Picnic Area', 'Private Parties', 'Tasting Room', 'Weddings']","[('Loudoun Wine Trail', 'https://www.visitloudoun.org\n'), (""Tuskie's Wine Trail"", 'http://www.tuskies.com/WineTrail/')]",['Virginia']
59,Courthouse Creek Cider,https://www.virginiawine.org/wineries/courthouse-creek-cider,http://www.courthousecreek.com,8045433157,"1581 Maidens Road, Maidens, VA 23102",Central Virginia,"Courthouse Creek Cider is a family run business producing fine Virginia cider, naturally. Our orchard and production facility, as well as tasting room, is located in beautiful Goochland County.  Our urban Cider Bar is located in the hip neighborhood of Scott's Addition!","(37.6733025, -77.8775973)",,,"['Features', 'Bus/RV Parking', 'Child Friendly', 'Food Available', 'Light Fare', 'Group Tours', 'Pet Friendly', 'Picnic Area', 'Private Parties', 'Tasting Room', 'Weddings', 'Wine Shop']",,
60,Coyote Hole Ciderworks,https://www.virginiawine.org/wineries/coyote-hole-ciderworks,www.coyotehole.com,,"225 Oak Grove Dr, Mineral, VA 23117",Central Virginia,Coyote Hole Ciderworks is a family owned and operated farm where we use 100% fresh VA fruit for our ciders. We have a full variety of events and activities and a beautiful production facility and event space. Come taste the difference of fresh fruit and our unique process to retain the natural sugars! Less sweet and more balanced flavors!,"(38.0864058, -77.8556272)","['Mon: 12:00 PM - 7:00 PM', 'Tues: 12:00 PM - 7:00 PM', 'Wed: 12:00 PM - 7:00 PM', 'Thurs: 12:00 PM - 9:00 PM', 'Fri: 12:00 PM - 9:00 PM', 'Sat: 12:00 PM - 9:00 PM', 'Sun: 12:00 PM - 7:00 PM', 'Bu: s', 'Child: Friendly', 'Food: Available: Light Fare', 'Food: Available: Restaurant', 'Group: Tours', 'Pet: Friendly', 'Picnic: Area', 'Private: Parties', 'Tasting: Room', 'Weddings:  ', 'Wine: Shop']",,"['Features', 'Bus/RV Parking', 'Child Friendly', 'Food Available', 'Light Fare', 'Food Available', 'Restaurant', 'Group Tours', 'Pet Friendly', 'Picnic Area', 'Private Parties', 'Tasting Room', 'Weddings', 'Wine Shop']",,
61,Creek's Edge Winery,https://www.virginiawine.org/wineries/creek-s-edge-winery,http://www.creeksedgewinery.com/,540-822-3825,"41255 Annas Lane, (The Historic Village of Taylorstown), Lovettsville, VA 20180",Northern Virginia,"Creeks Edge Winery is located in Historic Village of Taylorstown, Virginia.  Nestled in the foothills of Furnace Mountain and facing the Catoctin Creek, the estate vineyard showcases Chardonnay, Cabernet Sauvignon, Merlot & Chambourcin.  Mortise & tenon carpentry, belt fans of days gone by, featured black walnut from the property, a beautiful spiral staircase that is reminiscent of a barrel & climbs a feature that looks like a silo, all compliment the both the history and viewscape of the town & provide the perfect ambiance for an impromptu outing or backdrop for a wedding.","(39.2558298, -77.5727272)","['Mon: Closed - Closed', 'Tues: Closed - Closed', 'Wed: Closed - Closed', 'Thurs: 12:00 PM -  9:00 PM', 'Fri: 12:00 PM - 10:00 PM', 'Sat: 12:00 PM - 10:00 PM', 'Sun: 12:00 PM -  9:00 PM', 'Child: Friendly', 'Food: Available: Light Fare', 'Food: Available: Restaurant', 'Group: Tours', 'Pet: Friendly', 'Picnic: Area', 'Private: Parties', 'Tasting: Room', 'Weddings:  ', 'Wine: Shop', 'Loudoun: Wine Trail', 'Tuski: e']",Tour Fee: $25.00,"['Features', 'Child Friendly', 'Food Available', 'Light Fare', 'Food Available', 'Restaurant', 'Group Tours', 'Pet Friendly', 'Picnic Area', 'Private Parties', 'Tasting Room', 'Weddings', 'Wine Shop']","[('Loudoun Wine Trail', 'https://www.visitloudoun.org\n'), (""Tuskie's Wine Trail"", 'http://www.tuskies.com/WineTrail/')]","['California', 'Colorado', 'Minnesota', 'Virginia']"
62,CrossKeys Vineyards,https://www.virginiawine.org/wineries/crosskeys-vineyards,http://www.crosskeysvineyards.com,540-234-0505,"6011 East Timber Ridge Road, Mt. Crawford, VA 22841",Shenandoah Valley,"From the first plantings in 2002 to the opening of the state of the art facility in May of 2008, CrossKeys seeks to welcome guests to discover, taste and experience the best in estate grown wines.  Situated in the heart of the Shenandoah, only minutes from I-81, Massanutten Resort and downtown Harrisonburg, the winery provides panoramic views of vineyards and the surrounding mountains.  Open daily for tasting and tours, the facility houses the tasting room, winery and four distinct function rooms that are suitable for small and large groups.  The spacious courtyard and front terraces provides space to sit and relax while enjoying our Estate Wines.  A comprehensive program in wine education and the arts is a key component of the winery mission. Join us for lunch prepared by our executive chef daily.","(38.3227609, -78.8509813)","['Mon: Closed', 'Tues: Closed', 'Wed: 11:00 AM - 7:00 PM', 'Thurs: 11:00 AM - 7:00 PM', 'Fri: 11:00 AM - 8:00 PM', 'Sat: 11:00 AM - 8:00 PM', 'Sun: 11:00 AM - 7:00 PM', 'Child: Friendly', 'Food: Available: Restaurant', 'Group: Tours', 'Pet: Friendly', 'Private: Parties', 'Tasting: Room', 'Weddings:  ', 'Wine: Shop', 'Shenandoah: County Wine Trail', 'Shenandoah: Valley Wine Trail', 'Skyline: Wine Trail']",Tour Fee: $5.00,"['Features', 'Child Friendly', 'Food Available', 'Restaurant', 'Group Tours', 'Pet Friendly', 'Private Parties', 'Tasting Room', 'Weddings', 'Wine Shop']","[('Shenandoah County Wine Trail', 'https://www.ShenandoahTravel.org'), ('Shenandoah Valley Wine Trail', 'https://www.shenandoahvalleywinetrail.com'), ('Skyline Wine Trail', 'https://www.skylinewinetrail.com/')]","['Alabama', 'Alaska', 'Arizona', 'Arkansas', 'California', 'Colorado', 'Connecticut', 'Florida', 'Georgia', 'Hawaii', 'Idaho', 'Illinois', 'Indiana', 'Iowa', 'Kansas', 'Kentucky', 'Louisiana', 'Maine', 'Maryland', 'Michigan', 'Minnesota', 'Mississippi', 'Missouri', 'Montana', 'Nebraska', 'Nevada', 'Ohio', 'Oklahoma', 'Oregon', 'Pennsylvania', 'Tennessee', 'Texas', 'Utah', 'Vermont', 'Virginia', 'Washington', 'Wisconsin', 'Wyoming']"
63,Crushed Cellars,https://www.virginiawine.org/wineries/crushed-cellars,http://www.CrushedCellars.com,1.571.374.WINE (9463),"37938 Charles Town Pike, Purcellville, VA 20132",Northern Virginia,"Enjoy our warm and comfortable atmosphere along with our award winning wines including Gold Awards in the Finger Lakes International Competition and numerous  Silver & over 1/2 dozen Bronze awards winners at the San Francisco International Competition in both 2013 and 2014.  Conveniently located on rt.9, 1/2 mile west of rt. 287, 25 minutes from Dulles Airport.","(39.188262, -77.690543)","['Mon: Closed - Closed', 'Tues: Closed - Closed', 'Wed: Closed - Closed', 'Thurs: Closed - Closed', 'Fri: Closed - Closed', 'Sat: 12:00 PM -  5:00 PM', 'Sun: 12:00 PM -  5:00 PM', 'Food: Available: Light Fare', 'Picnic: Area', 'Private: Parties', 'Tasting: Room', 'Weddings:  ', 'Wine: Shop', 'Loudoun: Wine Trail', 'Tuski: e']",Tour Fee: N/A,"['Features', 'Food Available', 'Light Fare', 'Picnic Area', 'Private Parties', 'Tasting Room', 'Weddings', 'Wine Shop']","[('Loudoun Wine Trail', 'https://www.visitloudoun.org\n'), (""Tuskie's Wine Trail"", 'http://www.tuskies.com/WineTrail/')]","['California', 'Virginia']"
64,Cunningham Creek Winery,https://www.virginiawine.org/wineries/cunningham-creek-winery,http://www.cunninghamcreek.wine,(434) 207-3907,"3304 Ruritan Lake Road, Palmyra, VA 22963",Central Virginia,"We are a small family owned & operated winery focusing on making outstanding French varietals & blends.  We grow Chardonnay, Viognier, Pinot Gris, Cab Franc, Cab Sauvignon, Merlot & Petit Verdot. Assorted snacks are available for sale, however, you are always welcome to bring your own picnic.  We are family, cycle & dog friendly for friendly dogs. We invite you to enjoy your wine in our dog park & let your canine friends play.
**During Covid-19, we do require you to wear a face mask when entering, exiting, & ordering.  On Saturday & Sunday, reservations are recommended and can be booked at https://www.exploretock.com/cunninghamcreekwinery/","(37.875925, -78.3576314)","['Mon: Closed', 'Tues: Closed', 'Wed: Closed', 'Thurs: 2:00 PM - 6:00 PM', 'Fri: Closed', 'Sat: 1:00 PM - 8:00 PM', 'Sun: 1:00 PM - 6:00 PM', 'Bu: s', 'Child: Friendly', 'Food: Available: Light Fare', 'Pet: Friendly', 'Picnic: Area', 'Private: Parties', 'Tasting: Room', 'Weddings:  ', 'Wine: Shop', 'Monticello: Wine Trail']",,"['Features', 'Bus/RV Parking', 'Child Friendly', 'Food Available', 'Light Fare', 'Pet Friendly', 'Picnic Area', 'Private Parties', 'Tasting Room', 'Weddings', 'Wine Shop']","[('Monticello Wine Trail', 'https://www.monticellowinetrail.com\n')]","['Alaska', 'Arizona', 'California', 'Colorado', 'District of Columbia', 'Florida', 'Georgia', 'Hawaii', 'Idaho', 'Illinois', 'Indiana', 'Iowa', 'Kansas', 'Louisiana', 'Maine', 'Maryland', 'Massachusetts', 'Minnesota', 'Missouri', 'Nebraska', 'Nevada', 'New Hampshire', 'New Mexico', 'New York', 'North Carolina', 'North Dakota', 'Ohio', 'Oregon', 'Pennsylvania', 'South Carolina', 'Tennessee', 'Texas', 'Vermont', 'Virginia', 'Washington', 'West Virginia', 'Wisconsin', 'Wyoming']"
65,Davis Valley Winery,https://www.virginiawine.org/wineries/davis-valley-winery,http://dvwinery.com,276-686-8855,"1167 Davis Valley Road, Rural Retreat, VA 24368",Blue Ridge,Owners Rusty and Ruth Rhea Cox invite you to visit our farm winery and vineyards in the enchanting mountains of beautiful Southwestern Virginia. Drop by the Tasting Room to sample our wines on a 100 year-old handcrafted oak bar.,"(36.9059739, -81.3628784)","['Mon: 10:00 AM - 5:00 PM', 'Tues: 10:00 AM - 5:00 PM', 'Wed: 10:00 AM - 5:00 PM', 'Thurs: 10:00 AM - 5:00 PM', 'Fri: 10:00 AM - 5:00 PM', 'Sat: 10:00 AM - 5:00 PM', 'Sun: Closed', 'Group: Tours', 'Picnic: Area', 'Tasting: Room', 'Wine: Shop']",Tasting Fee: 0,"['Features', 'Group Tours', 'Picnic Area', 'Tasting Room', 'Wine Shop']",,['Virginia']
66,Delaplane Cellars,https://www.virginiawine.org/wineries/delaplane-cellars,http://www.delaplanecellars.com,540-592-7210,"2187 Winchester Road, Delaplane, Virginia 20144-1734",Northern Virginia,"We are a boutique family winery committed to producing ultra premium, artisan wines grown in a select handful of meticulously managed vineyards by growers who, like us, are obsessed with quality.","(38.950148, -77.936665)","['Mon: 11:00 AM - 5:00 PM', 'Tues: Closed', 'Wed: Closed', 'Thurs: 11:00 AM - 5:00 PM', 'Fri: 11:00 AM - 6:00 PM', 'Sat: 11:00 AM - 6:00 PM', 'Sun: 11:00 AM - 6:00 PM', 'Food: Available: Light Fare', 'Tasting: Room', 'Fauquier: County Wine Trail']",Tour Fee: NA,"['Features', 'Food Available', 'Light Fare', 'Tasting Room']","[('Fauquier County Wine Trail', 'https://www.fauquiertourism.com/wineries.html\n')]",
67,Delfosse Vineyards and Winery,https://www.virginiawine.org/wineries/delfosse-vineyards-and-winery-0,http://www.delfossewine.com,434-263-6100,"500 Delfosse Winery Lane, Faber, VA 22938",Central Virginia,"Located in the foothills of the Blue Ridge Mountains in the Monticello AVA, Delfosse Vineyards and Winery is committed to the sustainable production of high quality premium varietal wines that emphasize the outstanding Virginia terroir. Our pastoral farm setting with uniquely terraced vineyards, scenic vistas, lake, and picnic areas, offers the serenity -and the wines- to promise an engaging and fun experience.","(37.8918072, -78.7632217)","['Mon: Closed', 'Tues: Closed', 'Wed: 11:00 AM - 5:00 PM', 'Thurs: 11:00 AM - 5:00 PM', 'Fri: 11:00 AM - 5:00 PM', 'Sat: 11:00 AM - 5:00 PM', 'Sun: 11:00 AM - 5:00 PM', 'Child: Friendly', 'Food: Available: Light Fare', 'Overnight: Stay', 'Pet: Friendly', 'Picnic: Area', 'Private: Parties', 'Tasting: Room', 'Weddings:  ', 'Wine: Shop', 'Explore: Nelson Wine Trail', 'Jefferson: Heritage Trail', 'Monticello: Wine Trail']",Tasting Fee: 10.00,"['Features', 'Child Friendly', 'Food Available', 'Light Fare', 'Overnight Stay', 'Pet Friendly', 'Picnic Area', 'Private Parties', 'Tasting Room', 'Weddings', 'Wine Shop']","[('Explore Nelson Wine Trail', 'http://nelsoncounty.com/visit/wineriesbrewery/'), ('Jefferson Heritage Trail', 'https://jeffersonheritagetrail.com'), ('Monticello Wine Trail', 'https://www.monticellowinetrail.com\n')]","['Alaska', 'Arizona', 'California', 'Colorado', 'Connecticut', 'Delaware', 'Florida', 'Georgia', 'Hawaii', 'Idaho', 'Indiana', 'Louisiana', 'Maryland', 'Michigan', 'Minnesota', 'Missouri', 'Nebraska', 'Nevada', 'Ohio', 'Oregon', 'Texas', 'Vermont', 'Virginia', 'Washington', 'Wisconsin', 'Wyoming']"
68,Desert Rose Ranch & Winery,https://www.virginiawine.org/wineries/desert-rose-ranch-winery,http://www.desertrosewinery.com,540-635-3200,"13726 Hume Rd., Hume, VA 22639",Northern Virginia,"The winery opened in April 2011 and has a unique old western flair.  We are an operating horse ranch and horses will often be seen in the corral by the winery.  Take a step back in time in the tasting room which resembles an old west saloon.  The wines, however, are distinctly modern and have already achieved a loyal following.  The port styled dessert wine served with Virginia made chocolate is the highlight of the tasting line-up which includes eight or ten wines.  The tasting bar is also a treat as it includes money from around the world where the owners have lived or traveled.  We are surrounded by many other world class wineries and invite one and all to spend a day in the beautiful Virginia countryside.","(38.8395132, -78.0802968)","['Mon: 12:00 PM - 6:00 PM', 'Tues: 12:00 PM - 6:00 PM', 'Wed: 12:00 PM - 6:00 PM', 'Thurs: 12:00 PM - 6:00 PM', 'Fri: 12:00 PM - 6:00 PM', 'Sat: 12:00 PM - 6:00 PM', 'Sun: 12:00 PM - 6:00 PM', 'Child: Friendly', 'Food: Available: Light Fare', 'Group: Tours', 'Pet: Friendly', 'Picnic: Area', 'Private: Parties', 'Tasting: Room', 'Blue: Ridge ', 'Blue: Ridge Wine Trail', 'Blue: Ridge Wine Way', 'Fauquier: County Wine Trail', 'Tween: Rivers Trail', 'Vintage: Piedmont ']",Reserve Tasting Fee: 12.00,"['Features', 'Child Friendly', 'Food Available', 'Light Fare', 'Group Tours', 'Pet Friendly', 'Picnic Area', 'Private Parties', 'Tasting Room']","[('Blue Ridge “Whiskey Wine Loop”', 'https://www.discovershenandoah.com'), ('Blue Ridge Wine Trail', 'https://www.blueridgewinetrail.com\n'), ('Blue Ridge Wine Way', 'https://www.blueridgewineway.com\n'), ('Fauquier County Wine Trail', 'https://www.fauquiertourism.com/wineries.html\n'), ('Tween Rivers Trail', 'http://www.tweenriverstrail.com/'), ('Vintage Piedmont', 'http://vintagepiedmont.com/')]",['Virginia']
69,DeVault Family Vineyards ,https://www.virginiawine.org/wineries/devault-family-vineyards,http://www.devaultvineyards.com,434-993-0722,"247 Station Lane, Concord, VA  24538",Central Virginia,"DeVault Family Vineyards' name truly does say it all. Our family-owned and operated farm/winery, has a ""family"" atmosphere and the amenities to entertain the adults as well as the children who come and visit us. Our 31 acre farm includes an indoor, heated pool with a bathroom and shower. We have certified lifeguards available for private parties and during winery events. We also have a lighted tennis court, a children's swing set, as well as a children's playhouse, for your kids to enjoy. Our 20'x48' Tasting Room is available to rent for private parties and weddings.","(37.3469379, -78.971432)","['Mon: 11:00 AM -  6:00 PM', 'Tues: 11:00 AM -  6:00 PM', 'Wed: 11:00 AM -  6:00 PM', 'Thurs: 11:00 AM -  6:00 PM', 'Fri: 11:00 AM -  6:00 PM', 'Sat: 11:00 AM -  6:00 PM', 'Sun: Closed - Closed', 'Child: Friendly', 'Pet: Friendly', 'Picnic: Area', 'Private: Parties', 'Weddings:  ', 'Southern: Virginia Wine Trail']",Tasting Fee: 5.00,"['Features', 'Child Friendly', 'Pet Friendly', 'Picnic Area', 'Private Parties', 'Weddings']","[('Southern Virginia Wine Trail', 'https://virginiawine.org')]","['Arkansas', 'Florida', 'Idaho', 'Illinois', 'Louisiana', 'Minnesota', 'Missouri', 'Nebraska', 'Nevada', 'Ohio', 'Oregon', 'Wyoming']"
70,Doukénie Winery,https://www.virginiawine.org/wineries/doukenie-winery,http://www.DoukenieWinery.com,540-668-6464,"14727 Mountain Road, Hillsboro, Virginia 20132",Northern Virginia,"Located near historic Leesburg, Virginia, in the town of Hillsboro, Doukénie Winery is made up of 400 acres nestled in Loudoun County, Virginia’s famed “wine country,” just 45 miles from Washington, DC. This farm winery provides visitors and locals an escape from reality while increasing their knowledge of grapes and wine making. Founded in 1983, Doukénie Winery produced its first vintage in 1995 and has received numerous prestigious awards, over the years. Doukénie Winery produces five white wines, eight red wines and a raspberry fruit wine. Wine can be purchased through the Winery’s Heritage Club and in the Tasting Room.","(39.2081287, -77.7057943)","['Mon: 10:00 AM - 6:00 PM', 'Tues: 10:00 AM - 6:00 PM', 'Wed: 10:00 AM - 6:00 PM', 'Thurs: 10:00 AM - 6:00 PM', 'Fri: 10:00 AM - 6:00 PM', 'Sat: 10:00 AM - 6:00 PM', 'Sun: 10:00 AM - 6:00 PM', 'Food: Available: Light Fare', 'Group: Tours', 'Picnic: Area', 'Private: Parties', 'Tasting: Room', 'Loudoun: Wine Trail', 'Tuski: e']",Tour Fee: $50.00,"['Features', 'Food Available', 'Light Fare', 'Group Tours', 'Picnic Area', 'Private Parties', 'Tasting Room']","[('Loudoun Wine Trail', 'https://www.visitloudoun.org\n'), (""Tuskie's Wine Trail"", 'http://www.tuskies.com/WineTrail/')]","['Alaska', 'Arizona', 'California', 'Colorado', 'Connecticut', 'District of Columbia', 'Florida', 'Georgia', 'Hawaii', 'Idaho', 'Illinois', 'Indiana', 'Iowa', 'Kansas', 'Louisiana', 'Maine', 'Maryland', 'Michigan', 'Minnesota', 'Missouri', 'Montana', 'Nebraska', 'Nevada', 'New Hampshire', 'North Carolina', 'North Dakota', 'Ohio', 'Oregon', 'Pennsylvania', 'South Carolina', 'South Dakota', 'Tennessee', 'Texas', 'Vermont', 'Virginia', 'Washington', 'West Virginia', 'Wisconsin', 'Wyoming']"
71,Dry Mill Vineyards & Winery,https://www.virginiawine.org/wineries/dry-mill-vineyards-winery,http://www.drymillwine.com,703 737-3930,"18195 Dry Mill Road, Leesburg, Virginia 20175",Northern Virginia,"Dry Mill Vineyards & Winery is snuggled into nine rolling acres just one mile outside historic Leesburg in a stable and barn that was once home to the horses and dogs of the Loudoun Hunt Club. Owners Dean and Nancy Vanhuss, with their daughter Michelle Pizzarello, have carefully restored it, using nearly all of the original wood to keep the spirit of the stable intact and give the winery a distinct rustic feel. Exposed wood beams, a tin roof, sconces, and a fireplace give the winery an updated and warm feeling. The original large wooden storm shutters now slide past the winery's French doors, and the loft has two balconies overlooking the attractive grounds. The patio seats up to 30 people for wine tasting and light fare.  For Dean Vanhuss, winemaking is a retirement venture after a career in technology. He has been growing grapes in Loudoun since the late 1990s and currently has six acres planted, most at Short Hill Vineyards, their home in Lovettsville.","(39.112621, -77.603022)","['Mon: Closed', 'Tues: 12:00 PM - 5:00 PM', 'Wed: 12:00 PM - 5:00 PM', 'Thurs: 12:00 PM - 5:00 PM', 'Fri: 12:00 PM - 7:00 PM', 'Sat: 11:00 AM - 6:00 PM', 'Sun: Closed', 'Bu: s', 'Child: Friendly', 'Food: Available: Light Fare', 'Pet: Friendly', 'Picnic: Area', 'Private: Parties', 'Tasting: Room', 'Weddings:  ', 'Wine: Shop', 'Loudoun: Wine Trail', 'Tuski: e']",Tour Fee: $12 or $15,"['Features', 'Bus/RV Parking', 'Child Friendly', 'Food Available', 'Light Fare', 'Pet Friendly', 'Picnic Area', 'Private Parties', 'Tasting Room', 'Weddings', 'Wine Shop']","[('Loudoun Wine Trail', 'https://www.visitloudoun.org\n'), (""Tuskie's Wine Trail"", 'http://www.tuskies.com/WineTrail/')]",['Virginia']
72,DuCard Vineyards,https://www.virginiawine.org/wineries/ducard-vineyards,http://www.ducardvineyards.com,540-923-4206,"40 Gibson Hollow Lane, Etlan (Madison County), VA 22719",Central Virginia,"June 6, 2020 update:  Getting out into the countryside, including Shenandoah National Park all around us, with 300,000 acres of social distancing, can be a peaceful and fulfilling activity in times of stress.  Adding a bottle of wine can be a nice way to add to your outing, good for body, mind and spirit.","(38.512719, -78.304791)","['Mon: 3:00 PM - 6:00 PM', 'Tues: 3:00 PM - 6:00 PM', 'Wed: 3:00 PM - 6:00 PM', 'Thurs: 3:00 PM - 6:00 PM', 'Fri: 3:00 AM - 6:00 PM', 'Sat: 12:00 PM - 6:00 PM', 'Sun: 12:00 PM - 6:00 PM', 'Child: Friendly', 'Food: Available: Light Fare', 'Group: Tours', 'Pet: Friendly', 'Picnic: Area', 'Private: Parties', 'Tasting: Room', 'Weddings:  ', 'Blue: Ridge ', 'Foothills: Scenic Wine Trail', 'Skyline: Wine Trail', 'Tween: Rivers Trail']",Tour Fee: Groups: $15 pp incl. glass; call first,"['Features', 'Child Friendly', 'Food Available', 'Light Fare', 'Group Tours', 'Pet Friendly', 'Picnic Area', 'Private Parties', 'Tasting Room', 'Weddings']","[('Blue Ridge “Whiskey Wine Loop”', 'https://www.discovershenandoah.com'), ('Foothills Scenic Wine Trail', 'https://www.FootHillsScenicWineTrail.com'), ('Skyline Wine Trail', 'https://www.skylinewinetrail.com/'), ('Tween Rivers Trail', 'http://www.tweenriverstrail.com/')]","['Alaska', 'Arizona', 'California', 'Florida', 'Georgia', 'Hawaii', 'Idaho', 'Illinois', 'Indiana', 'Iowa', 'Kansas', 'Louisiana', 'Maine', 'Massachusetts', 'Minnesota', 'Missouri', 'Montana', 'Nebraska', 'Nevada', 'Ohio', 'Oregon', 'Pennsylvania', 'Tennessee', 'Texas', 'Virginia', 'Washington', 'Wisconsin', 'Wyoming']"
73,Eagletree Farm Vineyards,https://www.virginiawine.org/wineries/eagletree-farm-vineyards,Eagletreevineyards.com,703-777-5208,"15100 Harrison Hill Lane, Leesburg, Virginia 20176",Northern Virginia,"A family owned, chef driven winery/restaurant selling estate produced wines.  We feature an outdoor pavilion with a wood fired oven for pizza during nice weather.  Very picturesque, featuring a nature trail and open during the weekend evenings.  New in 2019, Full menu coming soon !!","(39.1994224, -77.4926545)","['Mon: Closed', 'Tues: Closed', 'Wed: Closed', 'Thurs: Closed', 'Fri: Closed', 'Sat: 12:00 PM - 8:00 PM', 'Sun: 12:00 PM - 6:00 PM', 'Bu: s', 'Child: Friendly', 'Food: Available: Light Fare', 'Food: Available: Restaurant', 'Group: Tours', 'Private: Parties', 'Tasting: Room', 'Weddings:  ']",Tasting Fee: $9.00 for a Flight,"['Features', 'Bus/RV Parking', 'Child Friendly', 'Food Available', 'Light Fare', 'Food Available', 'Restaurant', 'Group Tours', 'Private Parties', 'Tasting Room', 'Weddings']",,
