ID,name,vapage,website,phone,address,region,descr,reglatlong,times,fees,amenities,trails,shipsto
0,12 Ridges Vineyard,https://www.virginiawine.org/wineries/12-ridges-vineyard,www.12ridges.com,4349964252,"24981 Blue Ridge Pkwy, Vesuvius , VA 24483",Shenandoah Valley,"12 Ridges Vineyard is a family-owned, cool climate vineyard located directly on the stunning Blue Ridge Parkway at mile post 25.  At an elevation of 3,300 feet, ​12 Ridges is one of, if not the, highest altitude vineyard in Virginia and its permeable and stony soil low in clay, cooler temperatures, and low humidity offer an extraordinary opportunity for local wine grower, Tim Jordan, to experiment and ply his craft.  The terroir of 12 Ridges has the potential to allow for exceptional traditional method sparkling wines, which will be complemented by offerings of Chardonnay, Riesling, Pinot Gris, and Pinot Noir.  As we wait for our vines to mature and grow, we are offering a portfolio of cool climate wines from around the world. Come visit our Tasting Room and 360 degree hill top to experience panoramic views and exceptional cool climate wines!","(37.9010474, -79.1177746)","['Mon: Closed', 'Tues: Closed', 'Wed: 12:00 PM - 5:00 PM', 'Thurs: 12:00 PM - 5:00 PM', 'Fri: 12:00 PM - 8:00 PM', 'Sat: 11:00 AM - 5:00 PM', 'Sun: 11:00 AM - 5:00 PM', 'Bu: s', 'Child: Friendly', 'Food: Available: Light Fare', 'Group: Tours', 'Pet: Friendly', 'Picnic: Area', 'Private: Parties', 'Tasting: Room', 'Weddings:  ', 'Wine: Shop', 'Shenandoah: Valley Wine Trail']",Tasting Fee: $18,"['Features', 'Bus/RV Parking', 'Child Friendly', 'Food Available', 'Light Fare', 'Group Tours', 'Pet Friendly', 'Picnic Area', 'Private Parties', 'Tasting Room', 'Weddings', 'Wine Shop']","[('Shenandoah Valley Wine Trail', 'https://www.shenandoahvalleywinetrail.com')]",
1,2 Witches Winery and Brewing Co,https://www.virginiawine.org/wineries/2-witches-winery-and-brewing-co,http://www.2witcheswinebrew.com,434-549-2739,"209 Trade Street, Danville, Virginia 24541",Southern Virginia,"New farm winery located in Danville, Virginia along the Dan River.  Tastings and retail sales starting in mid-July 2014. Wine varieties include Cabernet Sauvignon, Petit Verdot, Traminette, Muscat Blanc, Sangria and Strawberry.  Outdoor seating, limited food, and entertainment available.  Check our website for additional information on events.","(36.5857031, -79.4211127)","Friday 5pm - 9pm
Saturday 12pm - 9pm
Sunday 1pm - 6pm
Other days/times by appointment.",Tasting Fee: $5.00,"['Features', 'Food Available', 'Light Fare', 'Group Tours', 'Picnic Area', 'Private Parties', 'Tasting Room', 'Weddings']","[('Southern Virginia Wine Trail', 'https://virginiawine.org')]",
2,50 West Vineyards,https://www.virginiawine.org/wineries/50-west-vineyards,www.50westvineyards.com,(571) 367 4760,"39060 John Mosby Highway, Middleburg, Virginia 20117",Northern Virginia,"50 West Vineyards is a farm vineyard located on Route 50 in Middleburg, Virginia. It was named after the historic Route 50, which spans the entire width of the United States – from Ocean City, Maryland, to Sacramento, California. The tasting room is a converted horse stable that sits high on a bluff offering stunning views of the Bull Run Mountain range. 50 West is rich with history, from being located in Civil War battle area to being an old horse farm. We aim to share that history with you every time you visit.","(38.9811984, -77.6583357)","['Mon: Closed - Closed', 'Tues: Closed - Closed', 'Wed: Closed - Closed', 'Thurs: Closed - Closed', 'Fri: 2:00 PM -  9:00 PM', 'Sat: 12:00 PM -  7:30 PM', 'Sun: 12:00 PM -  7:30 PM', 'Pet: Friendly', 'Loudoun: Wine Trail', 'Tuski: e']",Tasting Fee: 10.00,"['Features', 'Pet Friendly']","[('Loudoun Wine Trail', 'https://www.visitloudoun.org\n'), (""Tuskie's Wine Trail"", 'http://www.tuskies.com/WineTrail/')]","['Alaska', 'California', 'Florida', 'Maryland', 'Minnesota', 'Virginia']"
3,868 Estate Vineyards,https://www.virginiawine.org/wineries/868-estate-vineyards,https://868estatevineyards.com/,(540) 668-7008,"14001 Harpers Ferry Rd., Hillsboro, Virginia 20132",Northern Virginia,Winner of the 2020 Virginia Governor's Cup!,"(39.2311369, -77.739379)","['Mon: Closed', 'Tues: Closed', 'Wed: Closed', 'Thurs: Closed', 'Fri: 11:00 AM - 5:00 PM', 'Sat: 11:00 AM - 5:00 PM', 'Sun: 11:00 AM - 5:00 PM', 'Food: Available: Restaurant', 'Group: Tours', 'Picnic: Area', 'Private: Parties', 'Tasting: Room', 'Weddings:  ', 'Wine: Shop', 'Loudoun: Wine Trail', 'Tuski: e']",Reserve Tasting Fee: add'l $6.00,"['Features', 'Food Available', 'Restaurant', 'Group Tours', 'Picnic Area', 'Private Parties', 'Tasting Room', 'Weddings', 'Wine Shop']","[('Loudoun Wine Trail', 'https://www.visitloudoun.org\n'), (""Tuskie's Wine Trail"", 'http://www.tuskies.com/WineTrail/')]","['Alabama', 'Alaska', 'Arizona', 'California', 'Colorado', 'Florida', 'Georgia', 'Hawaii', 'Idaho', 'Illinois', 'Indiana', 'Iowa', 'Kansas', 'Louisiana', 'Maine', 'Maryland', 'Massachusetts', 'Minnesota', 'Missouri', 'Montana', 'Nebraska', 'Nevada', 'New Hampshire', 'New Mexico', 'New York', 'North Carolina', 'North Dakota', 'Ohio', 'Oregon', 'Pennsylvania', 'South Carolina', 'Tennessee', 'Texas', 'Virginia', 'Washington', 'West Virginia', 'Wisconsin', 'Wyoming']"
4,8 Chains North Winery,https://www.virginiawine.org/wineries/8-chains-north-winery,https://8chainsnorth.com/,571-439-2255,"38593 Daymont Lane, Waterford, Virginia 20197-1038",Northern Virginia,"8 Chains North is a boutique Loudoun County winery located just 8 miles west of Leesburg, Virginia. The winery includes an inviting Tasting Room, production, and a beautiful private event space perfect for weddings—all with stunning vineyard views.","(39.178823, -77.667649)","['Mon: 1:00 PM -  7:00 PM', 'Tues: Closed - Closed', 'Wed: Closed - Closed', 'Thurs: 1:00 PM -  7:00 PM', 'Fri: 1:00 PM -  7:00 PM', 'Sat: 12:00 PM -  7:00 PM', 'Sun: 12:00 PM -  7:00 PM', 'Food: Available: Light Fare', 'Group: Tours', 'Pet: Friendly', 'Picnic: Area', 'Private: Parties', 'Tasting: Room', 'Weddings:  ', 'Wine: Shop', 'Loudoun: Wine Trail', 'Tuski: e']",Tour Fee: 5.00,"['Features', 'Food Available', 'Light Fare', 'Group Tours', 'Pet Friendly', 'Picnic Area', 'Private Parties', 'Tasting Room', 'Weddings', 'Wine Shop']","[('Loudoun Wine Trail', 'https://www.visitloudoun.org\n'), (""Tuskie's Wine Trail"", 'http://www.tuskies.com/WineTrail/')]",['Virginia']
5,Abingdon Vineyards,https://www.virginiawine.org/wineries/abingdon-vineyards,http://www.abingdonvineyards.com,276-623-1255,"20530 Alvarado Rd, Abingdon, Virginia 24211",Blue Ridge,"From Napa to Appalachia... The Gardner Family moved from California to Virginia to build the legacy of Abingdon Vineyards. Come taste the world-class wine and enjoy a picnic on the river! Kids, dogs and kayaks welcome!","(36.6582305, -81.8889087)","['Mon: Closed - Closed', 'Tues: Closed - Closed', 'Wed: 11:00 AM - 6:00 PM', 'Thurs: 11:00 AM - 6:00 PM', 'Fri: 11:00 AM - 6:00 PM', 'Sat: 11:00 AM - 6:00 PM', 'Sun: 11:00 AM - 6:00 PM', 'Bu: s', 'Child: Friendly', 'Food: Available: Light Fare', 'Group: Tours', 'Pet: Friendly', 'Picnic: Area', 'Private: Parties', 'Tasting: Room', 'Weddings:  ', 'Wine: Shop']",Tour Fee: $25.00,"['Features', 'Bus/RV Parking', 'Child Friendly', 'Food Available', 'Light Fare', 'Group Tours', 'Pet Friendly', 'Picnic Area', 'Private Parties', 'Tasting Room', 'Weddings', 'Wine Shop']",,"['Arizona', 'Arkansas', 'California', 'Colorado', 'Florida', 'Hawaii', 'Idaho', 'Illinois', 'Indiana', 'Iowa', 'Kansas', 'Louisiana', 'Maine', 'Maryland', 'Massachusetts', 'Minnesota', 'Montana', 'Nevada', 'New York', 'North Dakota', 'Ohio', 'Oklahoma', 'Oregon', 'Pennsylvania', 'South Dakota', 'Tennessee', 'Texas', 'Vermont', 'Virginia', 'West Virginia', 'Wisconsin', 'Wyoming']"
6,Afton Mountain Vineyards,https://www.virginiawine.org/wineries/afton-mountain-vineyards,http://www.aftonmountainvineyards.com,540-456-8667,"234 Vineyard Lane, Afton, Virginia 22920",Central Virginia,"Afton Mountain Vineyards is one of Virginia's first farm wineries with our oldest vines dating from the late 1970's.  Our focus is on making wines of exceptional quality from our own estate-grown grapes. Our Tasting House is surrounded by vineyards, 360 degree mountain views and sits beside a 13 acre lake.  We grow 11 varieties on 25 acres. ""Grapes don't grow in ugly places""® Come see for yourself!","(38.0096984, -78.8550954)","['Mon: Closed', 'Tues: Closed', 'Wed: Closed', 'Thurs: 11:00 AM - 5:00 PM', 'Fri: 11:00 AM - 5:00 PM', 'Sat: 11:00 AM - 5:00 PM', 'Sun: 11:00 AM - 5:00 PM', 'Child: Friendly', 'Food: Available: Light Fare', 'Overnight: Stay', 'Pet: Friendly', 'Picnic: Area', 'Tasting: Room', 'Wine: Shop', 'Explore: Nelson Wine Trail', 'Monticello: Wine Trail', 'Nelson: 151']",Tour Fee: 15.00 for group tastings,"['Features', 'Child Friendly', 'Food Available', 'Light Fare', 'Overnight Stay', 'Pet Friendly', 'Picnic Area', 'Tasting Room', 'Wine Shop']","[('Explore Nelson Wine Trail', 'http://nelsoncounty.com/visit/wineriesbrewery/'), ('Monticello Wine Trail', 'https://www.monticellowinetrail.com\n'), ('Nelson 151', 'http://nelson151.com/')]","['Maryland', 'North Carolina', 'Pennsylvania', 'South Carolina', 'Texas', 'Virginia']"
7,Albemarle CiderWorks,https://www.virginiawine.org/wineries/albemarle-ciderworks,http://www.albemarleciderworks.com,434-979-1663,"2545 Rural Ridge Lane, North Garden, Virginia 22959",Central Virginia,Albemarle CiderWorks tasting room offers a rotating menu of samples of our premium craft ciders.,"(37.966555, -78.649848)","['Mon: Closed', 'Tues: Closed', 'Wed: 11:00 AM - 5:00 PM', 'Thurs: 11:00 AM - 5:00 PM', 'Fri: 11:00 AM - 5:00 PM', 'Sat: 11:00 AM - 5:00 PM', 'Sun: 11:00 AM - 5:00 PM', 'Bu: s', 'Child: Friendly', 'Food: Available: Light Fare', 'Group: Tours', 'Pet: Friendly', 'Picnic: Area', 'Private: Parties', 'Tasting: Room', 'Weddings:  ', 'Monticello: Wine Trail']",Reserve Tasting Fee: $9.00 / $12.00 (flights),"['Features', 'Bus/RV Parking', 'Child Friendly', 'Food Available', 'Light Fare', 'Group Tours', 'Pet Friendly', 'Picnic Area', 'Private Parties', 'Tasting Room', 'Weddings']","[('Monticello Wine Trail', 'https://www.monticellowinetrail.com\n')]","['Alabama', 'Alaska', 'Arizona', 'Colorado', 'District of Columbia', 'Florida', 'Georgia', 'Hawaii', 'Idaho', 'Illinois', 'Indiana', 'Iowa', 'Kansas', 'Louisiana', 'Maine', 'Maryland', 'Massachusetts', 'Minnesota', 'Missouri', 'Nebraska', 'Nevada', 'New Hampshire', 'New Mexico', 'New York', 'North Carolina', 'North Dakota', 'Ohio', 'Oregon', 'Pennsylvania', 'South Carolina', 'Tennessee', 'Texas', 'Vermont', 'Virginia', 'Washington', 'West Virginia', 'Wisconsin', 'Wyoming']"
8,Altillo Vineyards,https://www.virginiawine.org/wineries/altillo-vineyards,http://www.altillovineyards.com,"434-324-4160 	","620 Level Run Rd., Hurt, VA 24536      ",Southern Virginia,"Formerly Altavista Vineyards, we are a small family-run vineyard and winery, an easy 30 minute drive South from Lynchburg VA, 6.5 miles off of US HWY 29. We specialize in limited production of finely crafted wines. Our vineyard currently produces shiraz, chardonnay, viognier, merlot, cabernet franc, and cabernet sauvignon.  We supplement our own production by purchases of a small amount of high quality grapes from other Virginia growers.","(37.0647391, -79.244212)","['Mon: Closed - Closed', 'Tues: Closed - Closed', 'Wed: Closed - Closed', 'Thurs: Closed - Closed', 'Fri: Closed - Closed', 'Sat: 12:00 PM -  6:00 PM', 'Sun: Closed - Closed', 'Group: Tours', 'Overnight: Stay', 'Pet: Friendly', 'Picnic: Area', 'Private: Parties', 'Tasting: Room', 'Weddings:  ']",Tasting Fee: $10.00 credited toward purchase,"['Features', 'Group Tours', 'Overnight Stay', 'Pet Friendly', 'Picnic Area', 'Private Parties', 'Tasting Room', 'Weddings']",,
9,American Way Country Wines,https://www.virginiawine.org/wineries/american-way-country-wines,http://AMERICANWAYCOUNTRYWINES.COM,434-262-1250,"13750 VA-47, Chase City, VA 23924",Southern Virginia,"WE MAKE FRUIT WINES FROM OUR OWN FARM, INCLUDING BUT NOT LIMITED TO, APPLE, BLACKBERRY, CHERRY, ELDERBERRY, PEAR, PEACH, STRAWBERRY, PLUM, AND PUMPKIN, SOON TO BE ADDED ARE TOMATO, CANTALOUPE. AND RASPBERRY","(36.7942056, -78.3518657)","['Mon: 1:00 PM -  6:00 PM', 'Tues: 1:00 PM -  6:00 PM', 'Wed: 1:00 PM -  6:00 PM', 'Thurs: 1:00 PM -  6:00 PM', 'Fri: 1:00 PM -  6:00 PM', 'Sat: 1:00 PM -  6:00 PM', 'Sun: 1:00 PM -  6:00 PM', 'Food: Available: Light Fare', 'Group: Tours', 'Picnic: Area', 'Private: Parties', 'Tasting: Room', 'Weddings:  ', 'Wine: Shop']",,"['Features', 'Food Available', 'Light Fare', 'Group Tours', 'Picnic Area', 'Private Parties', 'Tasting Room', 'Weddings', 'Wine Shop']",,
10,AmRhein's Wine Cellars,https://www.virginiawine.org/wineries/amrhein-s-wine-cellars,http://www.amrheinwine.com,540-929-4632,"9243 Patterson Drive, Bent Mountain, Virginia 24059",Virginia Mountains,"AmRhein is a German name meaning “on the Rhein” (Rhine) River. AmRhein’s Wine Cellars is a Virginia family owned and operated, estate-grown winery.  Our vineyards were first planted in 1995 and our first crush occurred in 1999. We now have three vineyards (Bent Mountain, Franklin County and Botetourt) boasting 40 acres and yielding 20 varieties of grapes. Our wines have won numerous awards, and are considered to be some of the finest on the East Coast. With over 15 wines in classic styles of both reds and whites and in our own exclusive blends, AmRhein’s tempts every palate!","(37.121057, -80.152223)","['Mon: 11:00 AM - 5:00 PM', 'Tues: Closed - Closed', 'Wed: Closed - Closed', 'Thurs: 11:00 AM - 5:00 PM', 'Fri: 11:00 AM - 5:00 PM', 'Sat: 11:00 AM - 5:00 PM', 'Sun: 11:00 AM - 5:00 PM', 'Bu: s', 'Child: Friendly', 'Food: Available: Light Fare', 'Group: Tours', 'Pet: Friendly', 'Picnic: Area', 'Private: Parties', 'Tasting: Room', 'Weddings:  ', 'Wine: Shop', 'Mountain: Road Wine Experience ']",Tour Fee: Free,"['Features', 'Bus/RV Parking', 'Child Friendly', 'Food Available', 'Light Fare', 'Group Tours', 'Pet Friendly', 'Picnic Area', 'Private Parties', 'Tasting Room', 'Weddings', 'Wine Shop']","[('Mountain Road Wine Experience', 'http://www.mountainroadwineexperience.com/')]","['Alabama', 'Alaska', 'Arizona', 'Arkansas', 'California', 'Colorado', 'Connecticut', 'Delaware', 'Florida', 'Georgia', 'Hawaii', 'Idaho', 'Illinois', 'Indiana', 'Iowa', 'Kansas', 'Kentucky', 'Louisiana', 'Maine', 'Maryland', 'Massachusetts', 'Michigan', 'Minnesota', 'Mississippi', 'Missouri', 'Montana', 'Nebraska', 'Nevada', 'Ohio', 'Oklahoma', 'Oregon', 'Pennsylvania', 'Tennessee', 'Texas', 'Utah', 'Vermont', 'Virginia', 'Washington', 'Wisconsin', 'Wyoming']"
11,Ankida Ridge Vineyards,https://www.virginiawine.org/wineries/ankida-ridge-vineyards,http://www.ankidaridge.com,434-922-7678,"1304 Franklin Creek Rd., Amherst, VA 24521",Central Virginia,"Virginia’s “Little Burgundy”... 
Ankida Ridge - The Vrooman Family Farm & Vineyard is a family-run, micro-boutique vineyard, farm and winery located in Amherst County at 1800 feet on the eastern slope of the Blue Ridge Mountains. We grow exclusively Pinot Noir and Chardonnay.  With our first vintage in 2010, we received international acclaim for our elegant, Burgundian style wines.  On our low-vigor, granite soils, we practice sustainable, environmentally sensitive viticulture that offers our wines a true sense of place.
A second label of wines, ""Rockgarden,"" is produced on site by our winemaker, Nathan Vrooman, from grapes purchased from area vineyards.  These hand-crafted wines are also receiving high praise.","(37.7128238, -79.1756421)","['Mon: Closed', 'Tues: Closed', 'Wed: Closed', 'Thurs: Closed', 'Fri: Closed', 'Sat: 12:00 PM - 5:00 PM', 'Sun: 12:00 PM - 5:00 PM', 'Food: Available: Light Fare', 'Pet: Friendly', 'Picnic: Area', 'Private: Parties', 'Tasting: Room', 'Jefferson: Heritage Trail']",Reserve Tasting Fee: 15.00,"['Features', 'Food Available', 'Light Fare', 'Pet Friendly', 'Picnic Area', 'Private Parties', 'Tasting Room']","[('Jefferson Heritage Trail', 'https://jeffersonheritagetrail.com')]",
12,Arterra Wines,https://www.virginiawine.org/wineries/arterra-wines,http://www.arterrawines.com,540-422-3443,"1808 Leeds Manor Road, Delaplane, VA 20144",Northern Virginia,"Born from over a decade of experience producing some of the highest quality wines in Virginia, the Arterra Wines tasting room opened in February 2015, showcasing the wines made by Jason Murray as well as the Gallery and Studio of Hawkmoth Arts featuring beautiful one-of-a-kind fine arts by Sandy Gray-Murray.","(38.9640518, -77.9714155)","['Mon: Closed', 'Tues: Closed', 'Wed: Closed', 'Thurs: Closed', 'Fri: 12:00 PM - 6:00 PM', 'Sat: 12:00 PM - 6:00 PM', 'Sun: 12:00 PM - 6:00 PM', 'Picnic: Area', 'Tasting: Room', 'Fauquier: County Wine Trail', 'Tween: Rivers Trail']",Tour Fee: $35 cellar tasting,"['Features', 'Picnic Area', 'Tasting Room']","[('Fauquier County Wine Trail', 'https://www.fauquiertourism.com/wineries.html\n'), ('Tween Rivers Trail', 'http://www.tweenriverstrail.com/')]",
13,Ashton Creek Vineyard,https://www.virginiawine.org/wineries/ashton-creek-vineyard,http://www.ashtoncreekvineyard.com,804-896-1586,"14501 Jefferson Davis Hwy, Chester, VA 23831",Central Virginia,"Ashton Creek Vineyard is a working Vineyard, Winery and Event Center.  We are open 5 days a week to the Tasting Public, serving fine Virginia wines, ciders and select foods.  Specializing in corporate and private events and featuring a relaxed and enjoyable atmosphere.","(37.3269079, -77.4063912)","['Mon: Closed', 'Tues: Closed', 'Wed: 12:00 PM - 8:00 PM', 'Thurs: 12:00 PM - 8:00 PM', 'Fri: 12:00 PM - 8:00 PM', 'Sat: 12:00 PM - 8:00 PM', 'Sun: 12:00 PM - 6:00 PM', 'Bu: s', 'Food: Available: Restaurant', 'Pet: Friendly', 'Private: Parties', 'Tasting: Room', 'Weddings:  ', 'Wine: Shop']",Tasting Fee: 15.00,"['Features', 'Bus/RV Parking', 'Food Available', 'Restaurant', 'Pet Friendly', 'Private Parties', 'Tasting Room', 'Weddings', 'Wine Shop']",,"['Alabama', 'Alaska', 'Arizona', 'California', 'Colorado', 'District of Columbia', 'Florida', 'Georgia', 'Hawaii', 'Idaho', 'Illinois', 'Indiana', 'Iowa', 'Kansas', 'Kentucky', 'Louisiana', 'Maine', 'Maryland', 'Massachusetts', 'Minnesota', 'Missouri', 'Nebraska', 'Nevada', 'New Hampshire', 'New Mexico', 'New York', 'North Carolina', 'North Dakota', 'Ohio', 'Oklahoma', 'Oregon', 'Pennsylvania', 'South Carolina', 'Tennessee', 'Texas', 'Vermont', 'Virginia', 'Washington', 'West Virginia', 'Wisconsin', 'Wyoming']"
14,Aspen Dale Winery at The Barn,https://www.virginiawine.org/wineries/aspen-dale-winery-at-the-barn,http://www.aspendalewinery.com,(540)364-1722,"3180 Aspen Dale Lane (GPS:  11083 John Marshall Hwy), Delaplane, Virginia 20144",Northern Virginia,"Our philosophy: We strive to produce and serve excellent wine, presented in a fun and unique way. We hope to encourage you to explore the wonders of wine and food. And we aim to insure that each time you visit, you feel at home and relaxed.","(38.9078762, -77.9623541)","Monday through Thursday 11am - 5pm
Friday, Saturday 11am - 6pm
Sunday 12pm - 6pm",,"['Features', 'Child Friendly', 'Food Available', 'Light Fare', 'Group Tours', 'Pet Friendly', 'Picnic Area', 'Private Parties', 'Tasting Room', 'Weddings', 'Wine Shop']",,
15,Barboursville Vineyards,https://www.virginiawine.org/wineries/barboursville-vineyards,http://www.bbvwine.com,(540) 832-3824,"17655 Winery Road, Barboursville, Virginia 22923",Central Virginia,"A magnificent and historic Virginia estate between Monticello and Montpelier, home to Virginia's most honored winery, founded in 1976 by a family prominent in Italian viticulture since 1821. Producer of Octagon, the most renowned red wine of Virginia.","(38.1606026, -78.2770208)","['Mon: Closed', 'Tues: Closed', 'Wed: Closed', 'Thurs: Closed', 'Fri: Closed', 'Sat: Closed', 'Sun: Closed', 'Bu: s', 'Child: Friendly', 'Food: Available: Light Fare', 'Food: Available: Restaurant', 'Group: Tours', 'Overnight: Stay', 'Picnic: Area', 'Private: Parties', 'Tasting: Room', 'Weddings:  ', 'Wine: Shop', 'Monticello: Wine Trail']",Reserve Tasting Fee: $25.00+,"['Features', 'Bus/RV Parking', 'Child Friendly', 'Food Available', 'Light Fare', 'Food Available', 'Restaurant', 'Group Tours', 'Overnight Stay', 'Picnic Area', 'Private Parties', 'Tasting Room', 'Weddings', 'Wine Shop']","[('Monticello Wine Trail', 'https://www.monticellowinetrail.com\n')]","['California', 'Florida', 'Illinois', 'Maryland', 'Massachusetts', 'Michigan', 'Minnesota', 'Oregon', 'Pennsylvania', 'Virginia', 'Washington']"
16,Barrel Oak Winery,https://www.virginiawine.org/wineries/barrel-oak-winery,http://www.barreloak.com,540-364-6402,"3623 Grove Ln, Delaplane, VIRGINIA 20144",Northern Virginia,"Relax and discover our destination winery just off I-66, one hour west of DC and a world away. Enjoy award-winning wine, sweeping historic vistas, live music, and glorious sunsets from our extensive patio and picnic grounds. Take a tour of our wine cellar or a horseback ride through our vineyards. Our family and dog-friendly winery is the perfect place to spend the day!","(38.8867632, -77.905115)","['Mon: 12:00 PM -  7:00 PM', 'Tues: 12:00 PM -  7:00 PM', 'Wed: 12:00 PM -  7:00 PM', 'Thurs: 12:00 PM -  7:00 PM', 'Fri: 12:00 PM - 10:00 PM', 'Sat: 12:00 PM - 10:00 PM', 'Sun: 11:00 AM -  7:00 PM', 'Food: Available: Light Fare', 'Group: Tours', 'Picnic: Area', 'Private: Parties', 'Tasting: Room', 'Wine: Shop', 'Fauquier: County Wine Trail', 'Vintage: Piedmont ']",Tour Fee: 0.00,"['Features', 'Food Available', 'Light Fare', 'Group Tours', 'Picnic Area', 'Private Parties', 'Tasting Room', 'Wine Shop']","[('Fauquier County Wine Trail', 'https://www.fauquiertourism.com/wineries.html\n'), ('Vintage Piedmont', 'http://vintagepiedmont.com/')]","['Alaska', 'Arizona', 'California', 'Colorado', 'Connecticut', 'Delaware', 'Florida', 'Georgia', 'Idaho', 'Indiana', 'Iowa', 'Kansas', 'Louisiana', 'Maine', 'Michigan', 'Minnesota', 'Missouri', 'Nebraska', 'Nevada', 'Ohio', 'Oregon', 'Virginia', 'Washington', 'Wisconsin', 'Wyoming']"
17,Barren Ridge Vineyards,https://www.virginiawine.org/wineries/barren-ridge-vineyards,http://www.barrenridgevineyards.com,540-248-3300,"984 Barren Ridge Road, Fishersville, VA 22939",Shenandoah Valley,"Enjoy the sunsets over the Shenandoah Valley.  Barren Ridge Vineyards is open late with live music every Thursday, Friday and Saturday evening most weeks of the year.
Walk just a few steps into the tasting room and you can feel the Barren Ridge difference.  It’s relaxed.  There is no hustle or hard pressure sales.  It’s a place you want to spend time with friends and family. Relax, eat together and enjoy the wine.","(38.1336415, -78.9559139)","['Mon: Closed', 'Tues: Closed', 'Wed: 12:00 PM - 6:00 PM', 'Thurs: 12:00 PM - 6:00 PM', 'Fri: 12:00 PM - 6:00 PM', 'Sat: 12:00 PM - 6:00 PM', 'Sun: 1:00 PM - 6:00 PM', 'Bu: s', 'Child: Friendly', 'Food: Available: Light Fare', 'Pet: Friendly', 'Picnic: Area', 'Private: Parties', 'Tasting: Room', 'Weddings:  ', 'Wine: Shop', 'Shenandoah: Valley Wine Trail', 'Skyline: Wine Trail']",Tasting Fee: $8.00 - $10.00,"['Features', 'Bus/RV Parking', 'Child Friendly', 'Food Available', 'Light Fare', 'Pet Friendly', 'Picnic Area', 'Private Parties', 'Tasting Room', 'Weddings', 'Wine Shop']","[('Shenandoah Valley Wine Trail', 'https://www.shenandoahvalleywinetrail.com'), ('Skyline Wine Trail', 'https://www.skylinewinetrail.com/')]","['Alabama', 'Alaska', 'Arizona', 'California', 'Colorado', 'Florida', 'Georgia', 'Hawaii', 'Idaho', 'Illinois', 'Indiana', 'Iowa', 'Kansas', 'Louisiana', 'Maine', 'Maryland', 'Massachusetts', 'Minnesota', 'Missouri', 'Nebraska', 'Nevada', 'Ohio', 'Oregon', 'Pennsylvania', 'Tennessee', 'Texas', 'Virginia', 'Washington', 'Wisconsin', 'Wyoming']"
18,Beliveau Farm Winery,https://www.virginiawine.org/wineries/beliveau-farm-winery,http://www.BeliveauFarm.com,540-961-0505,"5415 Gallion Ridge Road, Blacksburg, VA 24060",Blue Ridge,"Beliveau Farm Winery is situated on 165 spectacular acres with on-site hiking, shaded picnic areas, award winning wines, and romantic lodging at the Manor House. Lite food fare is available for purchase.","(37.3160922, -80.2689263)","['Mon: Closed', 'Tues: Closed', 'Wed: 12:00 PM - 8:00 PM', 'Thurs: 12:00 PM - 6:00 PM', 'Fri: 12:00 PM - 9:00 PM', 'Sat: 12:00 PM - 6:00 PM', 'Sun: 12:00 PM - 6:00 PM', 'Bu: s', 'Child: Friendly', 'Food: Available: Light Fare', 'Overnight: Stay', 'Pet: Friendly', 'Picnic: Area', 'Private: Parties', 'Tasting: Room', 'Weddings:  ', 'Wine: Shop']",Tasting Fee: $10.00,"['Features', 'Bus/RV Parking', 'Child Friendly', 'Food Available', 'Light Fare', 'Overnight Stay', 'Pet Friendly', 'Picnic Area', 'Private Parties', 'Tasting Room', 'Weddings', 'Wine Shop']",,"['Arizona', 'Arkansas', 'California', 'Colorado', 'Florida', 'Georgia', 'Hawaii', 'Idaho', 'Illinois', 'Indiana', 'Iowa', 'Kansas', 'Louisiana', 'Maine', 'Maryland', 'Massachusetts', 'Minnesota', 'Missouri', 'Nebraska', 'Nevada', 'Ohio', 'Oregon', 'Pennsylvania', 'Tennessee', 'Texas', 'Virginia', 'Washington', 'Wisconsin', 'Wyoming']"
19,Big Fish Cider Co.,https://www.virginiawine.org/wineries/big-fish-cider-co,https://www.bigfishcider.com,5404682322,"59 Spruce Street, Monterey, VA 24465",Virginia Mountains,"Big Fish Cider Co is a microcidery in Monterey, Virginia making ciders using locally grown apples and traditional techniques to create completely new flavors. Our cider is available in a range of off-dry to semi-sweet blends and seasonal offerings.  Big Fish has won best in show, gold, silver and bronze awards at the Great Lakes Cider and Perry Competition.","(38.4123045, -79.5829305)","['Mon: Closed - Closed', 'Tues: Closed - Closed', 'Wed: Closed - Closed', 'Thurs: Closed - Closed', 'Fri: 5:00 PM -  8:00 PM', 'Sat: 3:00 PM -  8:00 PM', 'Sun: 2:00 PM -  6:00 PM']",Tasting Fee: 5.00,,,
