ID,name,vapage,website,phone,address,region,descr,reglatlong,times,fees,amenities,trails,shipsto
114,Ingleside Vineyards,https://www.virginiawine.org/wineries/ingleside-vineyards,http://inglesidevineyards.com/,804-224-8687,"5872 Leedstown Road, Oak Grove, Virginia 22443",Chesapeake Bay,"Ingleside Vineyards is one of the oldest and largest wineries in Virginia. Located in the Northern Neck of Virginia, Ingleside is surrounded by rich American history. Nearby are the birthplaces of George Washington, James Monroe and Robert E. Lee. This historic estate has been owned by the Flemer family for over one hundred years. Charles H. Flemer purchased Ingleside in 1890, and today one of his great-great grandsons is proprietor of Ingleside Vineyards, Doug Flemer.","(38.152715, -77.005706)","['Mon: 12:00 PM - 5:00 PM', 'Tues: 12:00 PM - 5:00 PM', 'Wed: 12:00 PM - 5:00 PM', 'Thurs: 12:00 PM - 5:00 PM', 'Fri: 12:00 PM - 5:00 PM', 'Sat: 12:00 PM - 5:00 PM', 'Sun: 12:00 PM - 5:00 PM', 'Child: Friendly', 'Food: Available: Light Fare', 'Group: Tours', 'Overnight: Stay', 'Picnic: Area', 'Private: Parties', 'Tasting: Room', 'Weddings:  ', 'Wine: Shop', 'Chesapeake: Bay Wine Trail']",Tour Fee: FREE,"['Features', 'Child Friendly', 'Food Available', 'Light Fare', 'Group Tours', 'Overnight Stay', 'Picnic Area', 'Private Parties', 'Tasting Room', 'Weddings', 'Wine Shop']","[('Chesapeake Bay Wine Trail', 'https://www.chesapeakebaywinetrail.com')]","['Alaska', 'Arizona', 'California', 'Colorado', 'Connecticut', 'Florida', 'Georgia', 'Hawaii', 'Idaho', 'Illinois', 'Indiana', 'Iowa', 'Kansas', 'Louisiana', 'Maine', 'Maryland', 'Michigan', 'Minnesota', 'Missouri', 'Nebraska', 'Nevada', 'Ohio', 'Oregon', 'Tennessee', 'Texas', 'Vermont', 'Virginia', 'Washington', 'Wisconsin', 'Wyoming']"
115,Iron Heart Winery,https://www.virginiawine.org/wineries/iron-heart-winery,http://www.ironheartwinery.com,540 320 0203,"3742 Boone Furnace Road, Allisonia, VA 24347",Blue Ridge,"IRON HEART WINERY stands on mineral-rich, and historical, ground in Allisonia, VA. A family owned farm nestled in the Appalachian Mountains of Southwest Virginia offering a charming retreat where all can comfortably enjoy each other’s company and excellent wine. Railroading and iron mining envelop the farm’s audacious history dating back to 1882, a tale that reveals resilient men and even stronger women.","(36.9214536, -80.7675732)","['Mon: Closed - Closed', 'Tues: Closed - Closed', 'Wed: Closed - Closed', 'Thurs: Closed - Closed', 'Fri: Closed - Closed', 'Sat: 1:00 PM -  5:00 PM', 'Sun: 2:00 PM -  5:00 PM', 'Child: Friendly', 'Food: Available: Light Fare', 'Group: Tours', 'Overnight: Stay', 'Picnic: Area', 'Private: Parties', 'Tasting: Room', 'Weddings:  ', 'Wine: Shop']",Reserve Tasting Fee: 10.00,"['Features', 'Child Friendly', 'Food Available', 'Light Fare', 'Group Tours', 'Overnight Stay', 'Picnic Area', 'Private Parties', 'Tasting Room', 'Weddings', 'Wine Shop']",,
116,Jacey Vineyards,https://www.virginiawine.org/wineries/jacey-vineyards,http://www.jaceyvineyards.com,(804)-580-4053,"619 Train Lane, P.O Box 338, Wicomico Church, VA 22579",Chesapeake Bay,"Jacey Vineyards lies in the delightful rural community of Wicomico Church, Virginia.","(37.799995, -76.335995)","['Mon: Closed - Closed', 'Tues: Closed - Closed', 'Wed: Closed - Closed', 'Thurs: Closed - Closed', 'Fri: Closed - Closed', 'Sat: 12:00 PM -  5:00 PM', 'Sun: Closed - Closed', 'Bu: s', 'Child: Friendly', 'Food: Available: Light Fare', 'Food: Available: Restaurant', 'Group: Tours', 'Overnight: Stay', 'Pet: Friendly', 'Picnic: Area', 'Private: Parties', 'Tasting: Room', 'Weddings:  ', 'Wine: Shop', 'Chesapeake: Bay Wine Trail']",Tour Fee: 0.00,"['Features', 'Bus/RV Parking', 'Child Friendly', 'Food Available', 'Light Fare', 'Food Available', 'Restaurant', 'Group Tours', 'Overnight Stay', 'Pet Friendly', 'Picnic Area', 'Private Parties', 'Tasting Room', 'Weddings', 'Wine Shop']","[('Chesapeake Bay Wine Trail', 'https://www.chesapeakebaywinetrail.com')]",
117,James Charles Winery & Vineyard,https://www.virginiawine.org/wineries/james-charles-winery-vineyard,http://jamescharleswine.com,(540) 931-4386,"4063 Middle Rd, Winchester, VA 22602",Shenandoah Valley,"Founded in 2015, James Charles Winery is the embodiment of the Bogaty's family story. We make old-world style wines in the heart of Virginia's Shenandoah Valley AVA, which strongly resembles classic winemaking regions in France. Our wines are bold, full-bodied and complex.","(39.1256703, -78.2306595)","['Mon: 12:00 PM -  5:00 PM', 'Tues: 12:00 PM -  5:00 PM', 'Wed: 12:00 PM -  5:00 PM', 'Thurs: 12:00 PM -  5:00 PM', 'Fri: 12:00 PM -  9:00 PM', 'Sat: 12:00 PM -  8:00 PM', 'Sun: 12:00 PM -  5:00 PM', 'Food: Available: Light Fare', 'Group: Tours', 'Picnic: Area', 'Private: Parties', 'Tasting: Room', 'Weddings:  ', 'Wine: Shop']",Tour Fee: $15.00,"['Features', 'Food Available', 'Light Fare', 'Group Tours', 'Picnic Area', 'Private Parties', 'Tasting Room', 'Weddings', 'Wine Shop']",,"['California', 'Florida', 'Virginia']"
118,James River Cellars,https://www.virginiawine.org/wineries/james-river-cellars,http://www.JamesRiverCellars.com,804-550-7516,"11008 Washington Highway, Glen Allen, Virginia 23059",Central Virginia,"This family-owned, family-run winery offers award winning wines from Virginia grown grapes. We are located just north of Richmond, off of Rte. 1 in Glen Allen (where I-95 and I-295 intersect, above the city).","(37.70106, -77.461977)","['Mon: 11:00 AM -  7:00 PM', 'Tues: 11:00 AM -  7:00 PM', 'Wed: 11:00 AM -  7:00 PM', 'Thurs: 11:00 AM -  7:00 PM', 'Fri: 11:00 AM -  7:00 PM', 'Sat: 11:00 AM -  7:00 PM', 'Sun: 11:00 AM -  6:00 PM', 'Bu: s', 'Child: Friendly', 'Food: Available: Light Fare', 'Group: Tours', 'Pet: Friendly', 'Picnic: Area', 'Private: Parties', 'Tasting: Room', 'Weddings:  ', 'Wine: Shop', 'Colonial: Virginia Wine Trail', 'Heart: of Virginia Wine Trail']",Tasting Fee: 10.00,"['Features', 'Bus/RV Parking', 'Child Friendly', 'Food Available', 'Light Fare', 'Group Tours', 'Pet Friendly', 'Picnic Area', 'Private Parties', 'Tasting Room', 'Weddings', 'Wine Shop']","[('Colonial Virginia Wine Trail', 'https://www.ColonialVirginiaWineTrail.com'), ('Heart of Virginia Wine Trail', 'https://www.hovawinetrail.com\n')]","['Delaware', 'Florida', 'Georgia', 'Kansas', 'Virginia']"
119,JBR Vineyards & Winery,https://www.virginiawine.org/wineries/jbr-vineyards-winery,http://www.facebook.com/jbrwine,540-250-7291,"8205 Little River Dam Road, Radford, VA 24141",Blue Ridge,"At an elevation of 1800 feet in the mountains of Giles County in Southwest Virginia, JBR Vineyards & Winery passionately produces small quantities of hand-tended classic wine grapes and hand-crafted wines. We are proud to have established the first vineyard and first Virginia Farm Winery in Giles County. Enjoy a unique experience!","(37.0697649, -80.572582)","['Mon: Closed - Closed', 'Tues: Closed - Closed', 'Wed: Closed - Closed', 'Thurs: Closed - Closed', 'Fri: Closed - Closed', 'Sat: Closed - Closed', 'Sun: Closed - Closed', 'Group: Tours', 'Tasting: Room', 'Wine: Shop']",Tasting Fee: $1.00/oz.,"['Features', 'Group Tours', 'Tasting Room', 'Wine Shop']",,
120,Jefferson Vineyards,https://www.virginiawine.org/wineries/jefferson-vineyards,http://www.jeffersonvineyards.com,434-977-3042,"1353 Thomas Jefferson Parkway, Charlottesville, VA 22902",Central Virginia,"In 1774 Thomas Jefferson and Philip Mazzei created Virginia's first commercial wine company and vineyard on our estate.  Four decades ago, we introduced quality modern viticulture to Virginia, helping realize Jefferson and Mazzei's dream.","(37.9915966, -78.4441462)","['Mon: Closed', 'Tues: Closed', 'Wed: Closed', 'Thurs: Closed', 'Fri: 11:00 AM - 6:00 PM', 'Sat: 11:00 AM - 6:00 PM', 'Sun: 11:00 AM - 6:00 PM', 'Overnight: Stay', 'Picnic: Area', 'Tasting: Room', 'Wine: Shop', 'Monticello: Wine Trail']",,"['Features', 'Overnight Stay', 'Picnic Area', 'Tasting Room', 'Wine Shop']","[('Monticello Wine Trail', 'https://www.monticellowinetrail.com\n')]","['California', 'Colorado', 'District of Columbia', 'Florida', 'Maryland', 'New York', 'North Carolina', 'Pennsylvania', 'Texas', 'Virginia']"
121,Jump Mountain Vineyard,https://www.virginiawine.org/wineries/jump-mountain-vineyard,http://www.jumpwines.com,540-348-6730,"1493 Walkers Creek Rd, Rockbridge Baths, VA 24473",Shenandoah Valley,"Jump Mountain Vineyard is a family-owned farm winery. Our goal is to produce carefully crafted, European-style wines with a distinctly local character from grapes grown and processed on the property. 
Protected by the sandstone knob of Jump Mountain, a local geographic landmark, the vineyard lies on the sunny hillsides of Walkers Creek Valley west of historic Lexington, Virginia.    The mesoclimate of this site provides conditions conducive to growing vinifera grape varieties.   Bring a picnic and enjoy spectacular views of Jump Mountain!","(37.9353429, -79.3871833)",Tasting available on weekends by appointment.,Tour Fee: $0,"['Features', 'Pet Friendly', 'Picnic Area']","[('Shenandoah Valley Wine Trail', 'https://www.shenandoahvalleywinetrail.com')]",
122,Keswick Vineyards,https://www.virginiawine.org/wineries/keswick-vineyards,http://www.keswickvineyards.com,(434) 244-3341,"1575 Keswick Winery Drive, Keswick, VA 22947",Central Virginia,"Keswick Vineyards, established in 2000 by Al & Cindy Schornberg, is a family owned and operated winery specializing in small lots of high-quality wines that showcase the terroir of the Estate. Originally from Michigan, the Schornbergs chose Virginia to pursue their dream of owning a vineyard after an extensive search that spanned coast to coast.  Al recalls his grandfather’s stories of working at his uncle’s winery, Massena Cellars in France, and like his predecessor, his goal was straightforward: “I just wanted to be able to enjoy a really good wine that I made. There’s something very natural and satisfying about that.”  With their first vintage in 2002 winning the honor of ""Best White Wine in America"" at the Atlanta International Wine Summit, the Schornbergs knew they had made the right decision and set out to prove Virginia could also produce award-winning reds.  In 2009 they were awarded the Virginia Governor's Cup for their 2007 Cabernet Sauvignon, further transforming their dream into a reality.  Now, in 2016 Keswick Vineyards received their second Virginia Governor's Cup for their 2014 Cabernet Franc Reserve.  The Schornbergs are humbled and excited that their vision has evolved into a world-class vineyard and winery, with each year's vintage better than the last.  
Visit us and taste our wines that are ""Born from the Soil and Soul of Virginia""!","(38.0702077, -78.2867246)","['Mon: 10:00 AM -  5:00 PM', 'Tues: 10:00 AM -  5:00 PM', 'Wed: 10:00 AM -  5:00 PM', 'Thurs: 10:00 AM -  5:00 PM', 'Fri: 10:00 AM -  5:00 PM', 'Sat: 10:00 AM -  5:00 PM', 'Sun: 10:00 AM -  5:00 PM', 'Bu: s', 'Child: Friendly', 'Food: Available: Light Fare', 'Group: Tours', 'Pet: Friendly', 'Picnic: Area', 'Private: Parties', 'Tasting: Room', 'Weddings:  ', 'Wine: Shop', 'Monticello: Wine Trail']",Reserve Tasting Fee: 15.00,"['Features', 'Bus/RV Parking', 'Child Friendly', 'Food Available', 'Light Fare', 'Group Tours', 'Pet Friendly', 'Picnic Area', 'Private Parties', 'Tasting Room', 'Weddings', 'Wine Shop']","[('Monticello Wine Trail', 'https://www.monticellowinetrail.com\n')]","['Alabama', 'Alaska', 'Arizona', 'California', 'Colorado', 'Florida', 'Georgia', 'Illinois', 'Indiana', 'Maryland', 'Massachusetts', 'Michigan', 'Minnesota', 'Missouri', 'Ohio', 'Pennsylvania', 'Texas', 'Virginia', 'Washington']"
123,"Kilaurwen Winery, LLC",https://www.virginiawine.org/wineries/kilaurwen-winery-llc,http://KilaurwenWinery.com,434 985 2535,"1543 Evergreen Church Road , Stanardsville, VA 22973",Central Virginia,"A small,intergeneratonal artisan winery with 10 ac of vinifera grapes---oldest in their 7th decade,youngest in their teens. Wine growers for top tier VA winerys since 1994. Nestled in the eastern slope Blue Ridge foothills, we have a south facing slope 600>800'above sea level, mature vines, and well ventilated site and 360 gorgeous mtn views We'll never be the biggest VA farm winery, and don't aspire to be.  A few bottles of great wines to share with customers and hopefully eventual friends is our goal. We're in the wine business for the wine not the business. We seek to price our creations to cover the costs of production plus a modest margin to be able to repeat the process year-to-year.","(38.2714052, -78.5285209)","['Mon: Closed - Closed', 'Tues: Closed - Closed', 'Wed: Closed - Closed', 'Thurs: Closed - Closed', 'Fri: 12:00 PM -  5:00 PM', 'Sat: 12:00 PM -  5:00 PM', 'Sun: 12:00 PM -  5:00 PM', 'Monticello: Wine Trail']",Tour Fee: 0,,"[('Monticello Wine Trail', 'https://www.monticellowinetrail.com\n')]",['Virginia']
124,King Family Vineyards,https://www.virginiawine.org/wineries/king-family-vineyards,http://www.kingfamilyvineyards.com,434-823-7800,"6550 Roseland Farm, Crozet, Virginia 22932",Central Virginia,"King Family Vineyards is a family owned and operated winery located at the foothills of the Blue Ridge Mountains in Crozet, Virginia just fifteen minutes from Charlottesville. The winery specializes in the production of ultra-premium wines that showcase the remarkable quality and terroir of the Monticello AVA. Beginning with carefully selected estate grapes, winemaker Matthieu Finot creates wines inspired by the old world, but are uniquely expressive of Virginia.","(38.0622239, -78.7285612)","['Mon: 10:00 AM -  5:30 PM', 'Tues: 10:00 AM -  5:30 PM', 'Wed: 10:00 AM -  8:30 PM', 'Thurs: 10:00 AM -  5:30 PM', 'Fri: 10:00 AM -  5:30 PM', 'Sat: 10:00 AM -  5:30 PM', 'Sun: 10:00 AM -  5:30 PM', 'Bu: s', 'Child: Friendly', 'Food: Available: Light Fare', 'Group: Tours', 'Pet: Friendly', 'Picnic: Area', 'Private: Parties', 'Tasting: Room', 'Weddings:  ', 'Wine: Shop', 'Monticello: Wine Trail']",Tour Fee: $20.00,"['Features', 'Bus/RV Parking', 'Child Friendly', 'Food Available', 'Light Fare', 'Group Tours', 'Pet Friendly', 'Picnic Area', 'Private Parties', 'Tasting Room', 'Weddings', 'Wine Shop']","[('Monticello Wine Trail', 'https://www.monticellowinetrail.com\n')]","['Alabama', 'California', 'Colorado', 'Florida', 'Georgia', 'Maryland', 'Missouri', 'Ohio', 'Oregon', 'Pennsylvania', 'Virginia', 'Washington']"
125,Knight's Gambit Vineyard,https://www.virginiawine.org/wineries/knight-s-gambit-vineyard,http://www.knightsgambitvineyard.com/,4345661168,"2218 Lake Albemarle Rd, Charlottesville, VA 22901",Central Virginia,"Knight's Gambit Vineyard is a family-run business that was established in 2003 and is over five acres of Petit Verdot, Pinot Grigio, Merlot, Chardonnay and Cabernet Franc. Our Tasting Room is located in the Monticello AVA on a rolling hillside facing the Blue Ridge Mountains near Charlottesville, Virginia. We produce Chardonnay, Pinot Grigio, Rosé, Petit Verdot, Cabernet Franc and Meritage wines. All of the wines we serve are made from estate grown fruit.","(38.0952851, -78.6225748)","['Mon: Closed', 'Tues: Closed', 'Wed: Closed', 'Thurs: 5:00 PM - 8:00 PM', 'Fri: 2:00 PM - 6:00 PM', 'Sat: 12:00 PM - 8:00 PM', 'Sun: 12:00 PM - 6:00 PM', 'Child: Friendly', 'Food: Available: Light Fare', 'Group: Tours', 'Overnight: Stay', 'Pet: Friendly', 'Picnic: Area', 'Private: Parties', 'Tasting: Room', 'Weddings:  ', 'Blue: Ridge Wine Trail', 'Monticello: Wine Trail']",Reserve Tasting Fee: $12,"['Features', 'Child Friendly', 'Food Available', 'Light Fare', 'Group Tours', 'Overnight Stay', 'Pet Friendly', 'Picnic Area', 'Private Parties', 'Tasting Room', 'Weddings']","[('Blue Ridge Wine Trail', 'https://www.blueridgewinetrail.com\n'), ('Monticello Wine Trail', 'https://www.monticellowinetrail.com\n')]",
126,Lake Anna Winery,https://www.virginiawine.org/wineries/lake-anna-winery,http://www.lawinery.com,540-895-5085,"5621 Courthouse Rd, Spotsylvania, VA 22551",Northern Virginia,"Second generation, Family-Owned and operated, established 1989 on 75 beautiful, rolling acres in Spotsylvania, County, Virginia.  Lake Anna Winery proudly offers Award-Winning Wines from Estate Grown Grapes.  Family, Friendly, and Affordable...
""There is No Perfect Wine for All Situations...Only Perfect Times for All Wines"".
We strive to create a variety of wines to appeal to a wide range of palates.","(38.1122628, -77.7663686)","Wed-Sat, 11am-5pm; Sun-1-5pm.  Closed Thanksgiving, Christmas and New Year's Day.",Tasting Fee: $7.00 with glass,"['Features', 'Bus/RV Parking', 'Child Friendly', 'Food Available', 'Light Fare', 'Group Tours', 'Pet Friendly', 'Picnic Area', 'Private Parties', 'Tasting Room', 'Weddings', 'Wine Shop']","[('Grapes and Grains Trail', 'http://tinyurl.com/ofqv38j'), ('Heart of Virginia Wine Trail', 'https://www.hovawinetrail.com\n')]","['Arizona', 'California', 'Colorado', 'Connecticut', 'Florida', 'Georgia', 'Hawaii', 'Idaho', 'Illinois', 'Indiana', 'Iowa', 'Kansas', 'Louisiana', 'Michigan', 'Minnesota', 'Missouri', 'Nevada', 'Ohio', 'Oregon', 'Tennessee', 'Texas', 'Vermont', 'Virginia', 'Washington', 'Wisconsin', 'Wyoming']"
127,Lazy Days Winery,https://www.virginiawine.org/wineries/lazy-days-winery,http://www.lazydayswinery.com  ,434-381-6088,"1351 N Amherst Hwy, Amherst, VA 24521",Central Virginia,"Located on US29 (N Amherst Hwy), just south of Route 151. Lazy Days Winery offers a relaxed down-home feel to a winery. With a large selection of wines, and central Virginia's most unique facity, you are in for a treat. The newly finished indoor/ outdoor amphitheatre is already becoming stage for lots of great event like Sangria Saturday, Virginia Summer Solstice Wine Festival, and Hallowine.","(37.6187582, -79.0205361)",Wednesday - Sunday 11:00AM to 5:00PM,Tour Fee: 0.00,"['Features', 'Child Friendly', 'Food Available', 'Light Fare', 'Pet Friendly', 'Picnic Area', 'Tasting Room', 'Weddings', 'Wine Shop']","[('Jefferson Heritage Trail', 'https://jeffersonheritagetrail.com')]",
128,Leo Grande Vineyards & Winery,https://www.virginiawine.org/wineries/leo-grande-vineyards-winery,http://www.leograndewinery.com,(540) 586-4066,"1343 Wingfield Drive, Goode, Virginia 24556",Virginia Mountains,"The Leo Grande Winery tasting room gives you the opportunity to sample all of the fine wines made on the winery premises The tatsing room staff is passionate and knowledgeable about wine and truly exemplify Virginia hospitality. Located only 12 mins. from Lynchburg, 25 mins from Smith Mountain Lake, and 45 mins. from Roanoke.","(37.3438609, -79.414057)","Year round. Wed-Sun, 11am-6pm.  During Jan and Feb Call 434-258-3902 for Sat and Sun appiontments closed wed thur fri",Tasting Fee: $4.00 incl glass,"['Features', 'Child Friendly', 'Food Available', 'Light Fare', 'Pet Friendly', 'Picnic Area', 'Private Parties', 'Tasting Room', 'Weddings', 'Wine Shop']","[('Bedford County Wine Trail', 'https://www.bedfordwinetrail.com\n')]","['Arkansas', 'Florida', 'Idaho', 'Louisiana', 'Missouri', 'Nebraska', 'Nevada', 'Ohio', 'Oregon', 'Virginia', 'Wyoming']"
129,Lexington Valley Vineyard,https://www.virginiawine.org/wineries/lexington-valley-vineyard,http://lexingtonvalleyvineyard.com,540-462-2974,"80 Norton Way, Rockbridge Baths, Virginia 24473",Shenandoah Valley,A family owned Virginia farm winery located about 15 minutes from Lexington in a beautiful setting nestled in the Shenandoah Valley. The winery features small vintage hand crafted wines.  Outside deck and snack baskets available during May - October.,"(37.865232, -79.419007)","['Mon: Closed', 'Tues: Closed', 'Wed: Closed', 'Thurs: Closed', 'Fri: Closed', 'Sat: 12:00 PM - 4:30 PM', 'Sun: 12:00 PM - 4:30 PM', 'Child: Friendly', 'Food: Available: Light Fare', 'Group: Tours', 'Pet: Friendly', 'Picnic: Area', 'Private: Parties', 'Tasting: Room', 'Shenandoah: Valley Wine Trail']",Tour Fee: 0,"['Features', 'Child Friendly', 'Food Available', 'Light Fare', 'Group Tours', 'Pet Friendly', 'Picnic Area', 'Private Parties', 'Tasting Room']","[('Shenandoah Valley Wine Trail', 'https://www.shenandoahvalleywinetrail.com')]","['Alaska', 'Florida', 'Idaho', 'Louisiana', 'Minnesota', 'Missouri', 'Nebraska', 'Nevada', 'Ohio', 'Oregon', 'Wyoming']"
130,Little Washington Winery,https://www.virginiawine.org/wineries/little-washington-winery,http://www.littlewashingtonwinery.com,540-987-8330,"72 Christmas Tree Lane, Washington, VA 22747",Northern Virginia,Little Washington Winery is tucked right into the sweet spot of Virginia Wine Country 60 miles west of Washington DC.,"(38.6913726, -78.1886047)","['Mon: Closed', 'Tues: Closed', 'Wed: Closed', 'Thurs: 11:00 AM - 5:00 PM', 'Fri: 11:00 AM - 5:00 PM', 'Sat: 11:00 AM - 6:00 PM', 'Sun: 11:00 AM - 5:00 PM', 'Bu: s', 'Child: Friendly', 'Food: Available: Light Fare', 'Food: Available: Restaurant', 'Group: Tours', 'Overnight: Stay', 'Pet: Friendly', 'Picnic: Area', 'Private: Parties', 'Tasting: Room', 'Weddings:  ', 'Wine: Shop', '211: Scenic Vino Trail', 'Artisanal: Wineries of Rappahannock County', 'Skyline: Wine Trail', 'Tween: Rivers Trail']",Tour Fee: n/a,"['Features', 'Bus/RV Parking', 'Child Friendly', 'Food Available', 'Light Fare', 'Food Available', 'Restaurant', 'Group Tours', 'Overnight Stay', 'Pet Friendly', 'Picnic Area', 'Private Parties', 'Tasting Room', 'Weddings', 'Wine Shop']","[('211 Scenic Vino Trail', 'https://www.211winetrail.com'), ('Artisanal Wineries of Rappahannock County', 'http://www.artwinerc.com/'), ('Skyline Wine Trail', 'https://www.skylinewinetrail.com/'), ('Tween Rivers Trail', 'http://www.tweenriverstrail.com/')]",['Virginia']
131,Loving Cup Vineyard & Winery,https://www.virginiawine.org/wineries/loving-cup-vineyard-winery,http://www.lovingcupwine.com,434.984.0774,"3340 Sutherland Road , North Garden, VA 22959",Central Virginia,CERTIFIED ORGANIC VINEYARD AND YUMMY WINES!,"(37.9515945, -78.6864918)","['Mon: Closed', 'Tues: Closed', 'Wed: Closed', 'Thurs: Closed', 'Fri: Closed', 'Sat: 11:00 AM - 5:00 PM', 'Sun: 11:00 AM - 5:00 PM', 'Child: Friendly', 'Food: Available: Light Fare', 'Pet: Friendly', 'Picnic: Area', 'Tasting: Room', 'Wine: Shop', 'Monticello: Wine Trail']",Tasting Fee: $8.00,"['Features', 'Child Friendly', 'Food Available', 'Light Fare', 'Pet Friendly', 'Picnic Area', 'Tasting Room', 'Wine Shop']","[('Monticello Wine Trail', 'https://www.monticellowinetrail.com\n')]","['Alaska', 'Florida', 'Minnesota', 'Virginia', 'Washington']"
132,Lovingston Winery,https://www.virginiawine.org/wineries/lovingston-winery,http://www.lovingstonwinery.com,4342638467,"885 Freshwater Cove Lane, Lovingston, VA 22949",Central Virginia,Boutique gravity-flow family winery specializing in traditional Bordeaux varietals as well as more unique ones such as Pinotage and Seyval Blanc,"(37.7277727, -78.9133048)","['Mon: Closed', 'Tues: Closed', 'Wed: 10:00 AM - 4:00 PM', 'Thurs: 10:00 AM - 4:00 PM', 'Fri: 11:00 AM - 5:00 PM', 'Sat: 11:00 AM - 5:00 PM', 'Sun: 11:00 AM - 5:00 PM', 'Child: Friendly', 'Food: Available: Light Fare', 'Group: Tours', 'Pet: Friendly', 'Picnic: Area', 'Tasting: Room', 'Explore: Nelson Wine Trail', 'Monticello: Wine Trail']",Tour Fee: none,"['Features', 'Child Friendly', 'Food Available', 'Light Fare', 'Group Tours', 'Pet Friendly', 'Picnic Area', 'Tasting Room']","[('Explore Nelson Wine Trail', 'http://nelsoncounty.com/visit/wineriesbrewery/'), ('Monticello Wine Trail', 'https://www.monticellowinetrail.com\n')]","['Alabama', 'California', 'Florida', 'Illinois', 'Iowa', 'Massachusetts', 'Michigan', 'Minnesota', 'Missouri', 'Ohio', 'Pennsylvania', 'Texas', 'Virginia']"
133,Maggie Malick Wine Caves,https://www.virginiawine.org/wineries/maggie-malick-wine-caves,http://www.maggiemalickwinecaves.com,540-905-2921,"12138 Harpers Ferry Rd, Purcellville, VA 20132",Northern Virginia,"Come and visit our unique man-made wine cave on our 215-acre estate, nestled at the foot of Short Hill Mountain, adorned with several ponds and gently rolling hills.  All of our wines are estate grown in our 30-acre vineyard, with 15 varieties of Old World grapes. Maggie's earned nearly 70 medals since she opened the Wine Cave in 2013. Sit back and enjoy our hand-crafted, Cave-aged wines while reviving your senses in the beautiful surroundings.  We are DOG FRIENDLY. Check our website for events and music throughout the summer. 
So that we may give all our customers the attention they deserve, we require that groups of 8 or more call for a reservation.","(39.2785968, -77.7217914)","['Mon: 11:00 AM - 6:00 PM', 'Tues: Closed', 'Wed: Closed', 'Thurs: 11:00 AM - 6:00 PM', 'Fri: 11:00 AM - 6:00 PM', 'Sat: 11:00 AM - 6:00 PM', 'Sun: 11:00 AM - 6:00 PM', 'Food: Available: Light Fare', 'Group: Tours', 'Pet: Friendly', 'Picnic: Area', 'Private: Parties', 'Tasting: Room', 'Weddings:  ', 'Loudoun: Wine Trail', 'Tuski: e']","Tasting Fee: $10 per person; $15 for groups of 8+, Group fee includes logo glass and requires a reservation.","['Features', 'Food Available', 'Light Fare', 'Group Tours', 'Pet Friendly', 'Picnic Area', 'Private Parties', 'Tasting Room', 'Weddings']","[('Loudoun Wine Trail', 'https://www.visitloudoun.org\n'), (""Tuskie's Wine Trail"", 'http://www.tuskies.com/WineTrail/')]","['Colorado', 'District of Columbia', 'Florida', 'Georgia', 'Illinois', 'Iowa', 'Maryland', 'Nevada', 'North Carolina', 'Ohio', 'Oregon', 'Pennsylvania', 'Virginia', 'Washington', 'West Virginia']"
